_id,latest_count_id,latest_count_date,location_name,longitude,latitude,centreline_type,centreline_id,px,count_duration,total_vehicle,total_bike,total_heavy_pct,total_pedestrian,am_peak_start,am_peak_vehicle,am_peak_bike,am_peak_heavy_pct,pm_peak_start,pm_peak_vehicle,pm_peak_bike,pm_peak_heavy_pct,n_appr_vehicle,n_appr_bike,n_appr_heavy_pct,e_appr_vehicle,e_appr_bike,e_appr_heavy_pct,s_appr_vehicle,s_appr_bike,s_appr_heavy_pct,w_appr_vehicle,w_appr_bike,w_appr_heavy_pct
1,115233,1/22/2026,Billy Bishop Way: Wilson Ave - Dufferin St,-79.45459442,43.72969476,1,14661251,,14,15171,1,0.01,18,2026-01-22T08:45:00,1001,0,0.016,2026-01-22T15:00:00,1395,0,0.006,3945,0,0.004,3651,0,0.012,0,0,0,7575,1,0.012
2,115436,1/20/2026,Bathurst St / Niagara St,-79.40186502,43.64191883,2,13467969,2363,14,15049,503,0.033,6644,2026-01-20T08:00:00,1306,30,0.029,2026-01-20T17:30:00,1418,53,0.01,4321,161,0.047,17,25,0,7372,235,0.03,3339,82,0.022
3,115434,1/20/2026,Bathurst St / Front St W,-79.401422,43.6407498,2,13468126,297,14,17082,413,0.033,4873,2026-01-20T08:00:00,1314,17,0.034,2026-01-20T17:30:00,1675,54,0.01,5884,156,0.039,3672,72,0.028,7526,184,0.03,0,1,0
4,115437,1/20/2026,Bathurst St / Wellington St W,-79.40215258,43.64264449,2,13467884,2528,14,13956,817,0.036,5086,2026-01-20T08:00:00,1012,67,0.04,2026-01-20T17:45:00,1394,97,0.007,4486,167,0.046,2044,197,0.03,7394,206,0.031,32,247,0
5,115439,1/20/2026,Bathurst St / Queen St W,-79.4040105,43.64718829,2,13467252,296,14,20497,605,0.031,10329,2026-01-20T08:00:00,1714,21,0.038,2026-01-20T17:15:00,1921,95,0.013,4821,102,0.032,5348,182,0.032,5692,115,0.03,4636,206,0.029
6,115438,1/20/2026,Bathurst St / King St W,-79.40270553,43.64392631,2,13467722,201,14,16314,869,0.04,11384,2026-01-20T08:30:00,1325,50,0.04,2026-01-20T17:45:00,1410,98,0.011,5812,189,0.042,814,231,0.107,5225,181,0.034,4463,268,0.034
7,115435,1/20/2026,Bathurst St / Fort York Blvd,-79.40064957,43.63883947,2,14255097,1919,14,18728,495,0.032,8045,2026-01-20T08:00:00,1472,31,0.039,2026-01-20T17:30:00,1865,60,0.011,6174,166,0.037,2666,110,0.031,4384,111,0.03,5504,108,0.029
8,115336,1/14/2026,Eglinton Ave W / Atlas Ave,-79.43838613,43.69825332,2,13458518,,14,22334,46,0.07,1535,2026-01-14T09:00:00,1722,3,0.079,2026-01-14T18:00:00,1665,7,0.054,287,0,0.014,10723,22,0.071,1405,2,0.016,9919,22,0.078
9,115335,1/14/2026,Eglinton Ave W / Winona Dr,-79.43904024,43.6981138,2,13458554,,14,20928,46,0.074,1660,2026-01-14T07:00:00,1612,3,0.078,2026-01-14T16:30:00,1586,6,0.062,0,0,0,10754,13,0.072,679,2,0.007,9495,31,0.082
10,115330,1/14/2026,Marlee Ave / Livingstone Ave,-79.43968136,43.6988046,2,13458417,,14,6449,57,0.055,1243,2026-01-14T08:00:00,607,1,0.061,2026-01-14T17:30:00,582,7,0.031,3090,33,0.065,0,0,0,1952,19,0.068,1407,5,0.016
11,115329,1/14/2026,Eglinton Ave W / Marlee Ave,-79.43937584,43.69804228,2,13458567,102,14,22767,74,0.072,3292,2026-01-14T09:00:00,1786,6,0.082,2026-01-14T18:15:00,1767,8,0.054,3707,31,0.057,10176,17,0.075,0,0,0,8884,26,0.074
12,115327,1/14/2026,Eglinton Ave W / Oakwood Ave,-79.44277173,43.6972852,2,13458706,103,14,23633,61,0.064,3462,2026-01-14T07:45:00,1855,0,0.068,2026-01-14T18:15:00,1786,5,0.041,0,2,0,10630,28,0.067,7389,7,0.051,5614,24,0.076
13,115322,1/14/2026,Dufferin St / Eglinton Ave W,-79.45027898,43.695692,2,13459036,105,14,35207,126,0.055,11292,2026-01-14T08:15:00,3199,5,0.064,2026-01-14T17:00:00,3301,18,0.025,9930,17,0.047,7838,35,0.063,9800,38,0.049,7639,36,0.063
14,115321,1/14/2026,Dufferin St / Livingstone Ave,-79.45080231,43.69640572,2,13458907,,14,21106,48,0.046,2603,2026-01-14T08:00:00,1942,1,0.045,2026-01-14T16:15:00,1966,2,0.03,10492,22,0.046,365,1,0.022,10249,25,0.048,0,0,0
15,115346,1/14/2026,Eglinton Ave W / Strathearn Rd / Ben Nobleman Park Trl,-79.43477748,43.69903689,2,13458376,,14,30353,44,0.038,2278,2026-01-14T08:30:00,2383,2,0.044,2026-01-14T14:15:00,2415,3,0.041,0,10,0,20585,8,0.034,4,2,0,9764,24,0.049
16,115345,1/14/2026,Allen Rd / Eglinton Ave W (East),-79.43503301,43.69899002,2,13458384,1307,14,38774,50,0.036,1841,2026-01-14T08:00:00,3001,2,0.035,2026-01-14T14:30:00,3058,2,0.033,0,0,0,20415,17,0.033,0,7,0,18359,26,0.039
17,115344,1/14/2026,Eglinton Ave W / Everden Rd,-79.43600384,43.69877318,2,13458420,,14,21505,40,0.06,1008,2026-01-14T06:45:00,1658,3,0.064,2026-01-14T14:00:00,1591,2,0.067,0,0,0,2398,16,0.319,208,0,0.01,18899,24,0.028
18,115342,1/14/2026,Everden Rd / Gloucester Grv,-79.43537394,43.69716871,2,13458711,,14,2573,24,0.012,561,2026-01-14T08:00:00,342,3,0.018,2026-01-14T15:45:00,234,3,0.004,975,7,0.011,147,4,0.014,270,4,0.015,1181,9,0.012
19,115341,1/14/2026,Winona Dr / Gloucester Grv (North),-79.4383966,43.69652309,2,13458839,,14,2785,51,0.019,560,2026-01-14T08:00:00,386,4,0.026,2026-01-14T15:30:00,347,10,0.003,695,18,0.014,955,9,0.024,2,20,0,1133,4,0.017
20,115340,1/14/2026,Atlas Ave / Gloucester Grv,-79.43775267,43.69665725,2,13458813,,14,2803,23,0.018,565,2026-01-14T08:00:00,375,4,0.011,2026-01-14T15:45:00,340,4,0.015,40,1,0,1442,8,0.021,604,4,0.023,717,10,0.008
21,115357,1/13/2026,Old Park Rd / Old Forest Hill Rd,-79.4317045,43.70151467,2,13458022,,14,4770,45,0.014,593,2026-01-13T08:00:00,545,5,0.009,2026-01-13T15:00:00,499,8,0.012,2463,19,0.017,1250,8,0.008,418,14,0.022,639,4,0.008
22,115356,1/13/2026,Glenarden Rd / Ridge Hill Dr,-79.43378123,43.70194318,2,13457961,,14,2777,11,0.015,617,2026-01-13T08:00:00,403,0,0.005,2026-01-13T14:45:00,318,1,0.019,1387,3,0.013,911,5,0.016,353,2,0.017,126,1,0.016
23,115366,1/13/2026,Bathurst St / Eglinton Ave W,-79.42556196,43.70099252,2,13458084,100,14,41474,56,0.034,5438,2026-01-13T08:00:00,3705,8,0.036,2026-01-13T17:30:00,3471,5,0.014,10004,13,0.025,11418,27,0.038,10553,10,0.03,9499,6,0.042
24,115365,1/13/2026,Bathurst St / Wembley Rd,-79.42564871,43.7015955,2,13457996,,14,19514,25,0.03,819,2026-01-13T07:45:00,1805,2,0.026,2026-01-13T15:45:00,1819,2,0.024,10190,12,0.028,0,0,0,8944,13,0.033,380,0,0.011
25,115364,1/13/2026,Bathurst St / Vesta Dr / Ridge Hill Dr,-79.42591117,43.70333747,2,13457713,918,14,18252,14,0.018,1115,2026-01-13T08:00:00,1766,2,0.009,2026-01-13T15:45:00,1750,3,0.017,9265,5,0.018,942,0,0.008,7499,8,0.019,546,1,0.015
26,115363,1/13/2026,Spadina Rd / Old Forest Hill Rd,-79.41699601,43.69899454,2,13458332,853,14,11023,45,0.03,452,2026-01-13T08:00:00,1123,5,0.03,2026-01-13T15:00:00,1044,5,0.033,3764,6,0.035,1846,14,0.021,3791,7,0.032,1622,18,0.026
27,115402,1/13/2026,Bathurst St / Avenal Dr,-79.42357702,43.69610812,2,13458889,,14,23958,27,0.037,308,2026-01-13T07:30:00,1898,3,0.049,2026-01-13T15:00:00,2004,1,0.029,11884,13,0.038,0,0,0,12071,13,0.036,3,1,0
28,115394,1/13/2026,Eglinton Ave W / Peveril Hill N,-79.42668646,43.70075881,2,13458117,,14,23706,72,0.047,3388,2026-01-13T07:45:00,1964,1,0.045,2026-01-13T17:45:00,1945,8,0.025,0,0,0,13551,29,0.044,324,3,0.028,9831,40,0.052
29,115370,1/13/2026,Bathurst St / Burton Rd / Strathearn Rd,-79.42187354,43.6919354,2,13459690,308,14,30149,52,0.028,511,2026-01-13T08:00:00,2542,7,0.029,2026-01-13T15:00:00,2543,4,0.024,11363,19,0.034,1897,10,0.014,14742,16,0.028,2147,7,0.003
30,115355,1/13/2026,Old Park Rd / Ridge Hill Dr,-79.43205664,43.70232469,2,13457896,,14,5017,48,0.017,669,2026-01-13T08:00:00,560,4,0.011,2026-01-13T16:30:00,538,3,0.006,2486,20,0.017,950,4,0.019,801,18,0.017,780,6,0.017
31,115354,1/13/2026,Glenarden Rd / Wembley Rd,-79.43311647,43.70030514,2,13458188,,14,2214,12,0.01,535,2026-01-13T08:00:00,240,1,0,2026-01-13T14:45:00,253,1,0.016,1083,3,0.008,674,4,0.006,293,3,0.02,164,2,0.018
32,115353,1/13/2026,Old Forest Hill Rd / Glenarden Rd,-79.43345531,43.70113779,2,13458077,,14,2161,9,0.009,418,2026-01-13T08:00:00,294,1,0.003,2026-01-13T14:45:00,246,0,0.016,1149,3,0.009,638,2,0.008,279,3,0.014,95,1,0.011
33,115352,1/13/2026,Hilltop Rd / Wembley Rd,-79.42792961,43.70141178,2,13458027,,14,2888,9,0.01,418,2026-01-13T08:15:00,321,0,0,2026-01-13T15:15:00,364,0,0.011,1098,3,0.008,510,1,0.01,913,3,0.015,367,2,0.005
34,115351,1/13/2026,Eglinton Ave W / Old Forest Hill Rd,-79.42314002,43.70150845,2,13458006,1748,14,23733,84,0.044,1859,2026-01-13T08:00:00,2305,8,0.045,2026-01-13T16:15:00,1948,11,0.03,2159,10,0.014,11924,25,0.047,1592,15,0.017,8058,34,0.054
35,115349,1/13/2026,Old Park Rd / Wembley Rd,-79.43137707,43.70068486,2,13458131,,14,3230,31,0.014,686,2026-01-13T08:00:00,349,3,0.011,2026-01-13T15:30:00,398,6,0.01,1687,12,0.015,834,3,0.01,446,16,0.018,263,0,0.015
36,115382,1/13/2026,Camberwell Rd / Dewbourne Ave,-79.42900449,43.69786706,2,13458571,,14,1658,6,0.012,170,2026-01-13T08:00:00,217,0,0.005,2026-01-13T15:15:00,215,0,0.014,1,0,0,1212,4,0.014,0,0,0,445,2,0.007
37,115371,1/13/2026,Burton Rd / Richview Ave,-79.42069115,43.69214347,2,13459635,,14,3364,16,0.015,213,2026-01-13T08:00:00,449,2,0.024,2026-01-13T16:30:00,359,0,0.006,173,3,0.006,1830,7,0.013,0,0,0,1361,6,0.019
38,115372,1/13/2026,Chiltern Hill Rd / Croydon Rd,-79.42597113,43.6931873,2,13459447,,14,1100,12,0.007,141,2026-01-13T08:00:00,180,0,0,2026-01-13T15:15:00,153,4,0.007,292,5,0.017,574,3,0.005,234,4,0,0,0,0
39,115373,1/13/2026,Bathurst St / Croydon Rd,-79.4223263,43.69305755,2,13459462,,14,26016,25,0.03,254,2026-01-13T07:30:00,2113,2,0.043,2026-01-13T15:00:00,2138,3,0.025,11674,11,0.034,0,0,0,14236,13,0.028,106,1,0.019
40,115374,1/13/2026,Bathurst St / Markdale Ave,-79.42274738,43.69410419,2,13459280,,14,26027,33,0.03,136,2026-01-13T07:30:00,2098,4,0.039,2026-01-13T14:45:00,2165,1,0.026,11600,16,0.033,0,0,0,14123,15,0.028,304,2,0.013
41,115378,1/13/2026,Rosemary Rd / Rosemary Lane / Dewbourne Ave,-79.42246207,43.69951709,2,13458279,,14,1162,14,0.025,129,2026-01-13T08:15:00,164,1,0.006,2026-01-13T15:15:00,161,1,0.019,113,1,0.08,375,5,0.027,372,2,0.013,302,6,0.017
42,115367,1/13/2026,Bathurst St / Dewbourne Ave,-79.42476592,43.69902285,2,13458356,,14,24533,14,0.027,435,2026-01-13T07:30:00,1969,2,0.036,2026-01-13T17:30:00,2047,0,0.009,12504,7,0.024,206,3,0.039,11747,4,0.03,76,0,0.039
43,115380,1/13/2026,Chiltern Hill Rd / Dewbourne Ave,-79.42688011,43.69833045,2,13458473,,14,4018,9,0.013,397,2026-01-13T08:00:00,508,1,0.012,2026-01-13T15:15:00,471,0,0.019,432,2,0.014,1965,2,0.016,1089,3,0.012,532,2,0.004
44,115381,1/13/2026,Ava Rd / Chiltern Hill Rd,-79.42656203,43.69749657,2,13458629,,14,3535,18,0.012,492,2026-01-13T08:00:00,563,1,0.012,2026-01-13T15:30:00,464,0,0.015,1478,5,0.013,4,3,0,1264,1,0.008,789,9,0.016
45,115383,1/13/2026,Glen Cedar Rd / Dewbourne Ave,-79.43002514,43.69765452,2,13458611,,14,5179,28,0.009,525,2026-01-13T08:15:00,511,3,0.016,2026-01-13T15:00:00,501,5,0.008,2,6,0,1034,3,0.007,3252,18,0.01,891,1,0.007
46,115384,1/13/2026,Ava Rd / Glen Cedar Rd,-79.42966726,43.69682806,2,13458765,,14,5310,34,0.018,735,2026-01-13T08:00:00,536,3,0.013,2026-01-13T15:00:00,595,3,0.027,488,9,0.016,963,1,0.015,2840,17,0.015,1019,7,0.031
47,115385,1/13/2026,Ava Rd / Strathearn Rd (West),-79.4335696,43.69598158,2,13458941,,14,5085,27,0.012,535,2026-01-13T08:00:00,698,2,0.013,2026-01-13T14:45:00,510,2,0.025,1451,11,0.01,763,2,0.014,753,7,0.012,2118,7,0.013
48,115386,1/13/2026,Westover Hill Rd / Dewbourne Ave,-79.43197068,43.69724889,2,13458688,,14,1868,9,0.01,363,2026-01-13T08:00:00,200,1,0.015,2026-01-13T15:15:00,312,0,0.006,2,2,0,787,5,0.01,711,2,0.007,368,0,0.014
49,115387,1/13/2026,Flanders Rd / Dewbourne Ave,-79.43295484,43.69703583,2,13458730,,14,1319,5,0.011,247,2026-01-13T08:00:00,179,2,0.034,2026-01-13T15:30:00,206,0,0.005,2,0,0,691,4,0.01,0,0,0,626,1,0.013
50,115388,1/13/2026,Eglinton Ave W / Glenarden Rd,-79.43277,43.69945676,2,13458307,,14,30291,39,0.039,1801,2026-01-13T08:00:00,2534,2,0.036,2026-01-13T15:45:00,2415,5,0.027,1589,3,0.008,18352,11,0.036,775,0,0.01,9575,25,0.052
51,115390,1/13/2026,Eglinton Ave W / Glen Cedar Rd,-79.43088397,43.69985777,2,13458244,101,14,28892,75,0.042,2835,2026-01-13T07:45:00,2492,5,0.037,2026-01-13T18:00:00,2324,3,0.023,1801,16,0.017,14275,13,0.043,3746,17,0.017,9070,29,0.055
52,115392,1/13/2026,Eglinton Ave W / Camberwell Rd,-79.42988277,43.70006873,2,13458213,,14,24560,48,0.046,2282,2026-01-13T07:30:00,2227,2,0.042,2026-01-13T17:45:00,1994,6,0.027,0,0,0,14050,19,0.043,506,0,0.028,10004,29,0.052
53,115393,1/13/2026,Eglinton Ave W / Chiltern Hill Rd,-79.42773523,43.70053514,2,13458146,,14,25796,64,0.045,3702,2026-01-13T07:30:00,2280,1,0.043,2026-01-13T17:45:00,2105,5,0.025,919,0,0.014,13514,32,0.044,1562,2,0.018,9801,30,0.053
54,115362,1/13/2026,Eglinton Ave W / Spadina Rd,-79.41910857,43.70235173,2,13457863,99,14,25424,92,0.043,1387,2026-01-13T08:00:00,2606,5,0.043,2026-01-13T17:30:00,2067,8,0.023,0,1,0,10060,44,0.05,5980,12,0.025,9384,35,0.046
55,115358,1/13/2026,Old Forest Hill Rd / Hilltop Rd,-79.42829791,43.70225671,2,13457901,,14,5239,30,0.012,232,2026-01-13T08:00:00,610,3,0.005,2026-01-13T15:15:00,559,3,0.013,1315,9,0.011,1601,12,0.009,687,1,0.017,1636,8,0.014
56,115156,1/10/2026,Harbour Sq / Bay St / Queens Quay W,-79.37684131,43.64115254,2,13468022,2416,14,11283,731,0.025,9130,,0,0,0,,0,0,0,2023,67,0.046,5386,288,0.024,586,60,0.002,3288,316,0.019
57,115168,1/10/2026,Yonge St / Front St E / Front St W,-79.37697432,43.64688479,2,13467239,29,14,17342,708,0.018,17295,,0,0,0,,0,0,0,4546,231,0.02,8,21,0,7865,235,0.009,4923,221,0.03
58,115160,1/10/2026,Bay St / Front St W,-79.37913498,43.64598706,2,13467389,59,14,20380,659,0.019,27046,,0,0,0,,0,0,0,5401,182,0.032,2855,109,0.023,7127,113,0.018,4997,255,0.004
59,115157,1/10/2026,Harbour St / Bay St / Waterfront Trl,-79.37746161,43.64207839,2,13467909,213,14,20756,369,0.024,7587,,0,0,0,,0,0,0,2171,75,0.041,9,111,0,2980,84,0.031,15596,99,0.02
60,115140,1/10/2026,York St / Harbour St,-79.38067791,43.64097011,2,13468047,204,14,25857,394,0.016,7445,,0,0,0,,0,0,0,2897,126,0.021,29,84,0,2124,108,0.011,20807,76,0.015
61,115204,1/10/2026,Queens Quay E / Cooper St,-79.37149907,43.64302764,2,13467771,,14,9404,637,0.026,2951,,0,0,0,,0,0,0,803,65,0.007,4180,78,0.027,0,4,0,4421,490,0.03
62,115203,1/10/2026,Queens Quay E / Yonge St / Queens Quay W / Martin Goodman Trl,-79.37466492,43.6419434,2,13467923,1588,14,11489,797,0.025,6353,,0,0,0,,0,0,0,3162,105,0.012,4841,408,0.024,0,2,0,3486,282,0.037
63,115200,1/10/2026,Yonge St / Harbour St,-79.37520891,43.64276194,2,13467825,,14,4642,225,0.016,2050,,0,0,0,,0,0,0,1854,94,0.009,0,0,0,1564,118,0.022,1224,13,0.018
64,115198,1/10/2026,Lake Shore Blvd E / Yonge St / Harbour St,-79.37547062,43.64332969,2,13467752,1541,14,11420,361,0.021,3163,,0,0,0,,0,0,0,1901,133,0.009,6,28,0,1589,124,0.021,7924,76,0.024
65,115196,1/10/2026,Lake Shore Blvd E / John M Tinsley St,-79.37105848,43.64524134,2,30137693,,14,3920,203,0.003,1410,,0,0,0,,0,0,0,0,0,0,1,18,0,191,52,0.016,3728,133,0.003
66,115190,1/10/2026,Lake Shore Blvd E / Cooper St,-79.37232307,43.64498665,2,13467532,,14,4213,111,0.012,1625,,0,0,0,,0,0,0,0,0,0,6,2,0,293,5,0.027,3914,104,0.011
67,115180,1/10/2026,Queens Quay E / Lower Jarvis St,-79.36896209,43.64392548,2,13467665,821,14,11009,659,0.031,4632,,0,0,0,,0,0,0,1377,91,0.016,5000,69,0.037,0,18,0,4632,481,0.029
68,115176,1/10/2026,Lower Jarvis St / The Esplanade,-79.3709074,43.64819861,2,13467011,1392,14,21440,611,0.016,9567,,0,0,0,,0,0,0,10981,108,0.009,561,186,0.103,8868,177,0.013,1030,140,0.055
69,115170,1/10/2026,Yonge St / The Esplanade,-79.37650308,43.64578388,2,13467425,2345,14,13124,575,0.01,6050,,0,0,0,,0,0,0,3224,169,0.009,1854,200,0.019,8031,205,0.007,15,1,0.333
70,115169,1/10/2026,Jarvis St / Lower Jarvis St / Front St E,-79.37142707,43.64943718,2,13466793,2,14,28192,643,0.008,20635,,0,0,0,,0,0,0,9834,112,0.009,4914,221,0.008,8705,124,0.006,4739,186,0.008
71,115219,12/11/2025,Borough Dr / Town Centre Crt (North),-79.2535497,43.77439656,2,13446525,,14,12630,18,0.018,1566,2025-12-11T08:15:00,806,1,0.017,2025-12-11T17:15:00,1268,2,0.012,3264,9,0.011,5119,7,0.022,1759,0,0.022,2488,2,0.017
72,115217,12/11/2025,Linkwood Lane / Edgecliff Golfway,-79.32703036,43.71866866,2,13455004,,14,8085,6,0.026,504,2025-12-11T08:15:00,730,0,0.018,2025-12-11T15:45:00,847,0,0.041,2902,3,0.022,1485,1,0.011,3698,2,0.036,0,0,0
73,115214,12/11/2025,Homewood Ave / Maitland Pl,-79.37550804,43.6656999,2,13464190,,14,3451,150,0.025,2031,2025-12-11T08:15:00,364,6,0.052,2025-12-11T16:30:00,308,19,0.003,1921,44,0.017,0,8,0,1309,52,0.034,221,46,0.036
74,115211,12/11/2025,Albion Rd / Todd Brook Dr,-79.57161643,43.73828153,2,13452584,,14,23125,20,0.032,176,2025-12-11T08:45:00,1616,1,0.051,2025-12-11T16:00:00,2170,0,0.027,264,0,0.019,10117,6,0.032,0,0,0,12744,14,0.032
75,115041,12/3/2025,DVP / DVP S Lawrence E Ramp / Lawrence Ave E / Lawrence W DVP S Ramp,-79.33228381,43.73945978,2,13451877,,14,39562,13,0.035,15,2025-12-03T07:45:00,3333,2,0.035,2025-12-03T16:15:00,3641,2,0.02,4120,5,0.02,19251,7,0.039,0,0,0,16191,1,0.035
76,115044,12/3/2025,Lawrence Ave E: Greencedar Crct - Markham Rd,-79.22919887,43.75899453,1,11485087,1696,14,24289,29,0.027,699,2025-12-03T08:45:00,1591,0,0.042,2025-12-03T15:30:00,2315,3,0.021,469,0,0.006,11551,10,0.027,2462,10,0.009,9807,9,0.032
77,115042,12/3/2025,CN Rail / Don Valley S Lawrence Ramp / Lawrence Ave E / Lawrence E DVP S Ramp,-79.3347176,43.73894303,2,13451969,,14,36610,18,0.034,19,2025-12-03T08:00:00,2879,1,0.034,2025-12-03T15:30:00,3665,1,0.028,0,0,0,13300,4,0.036,4365,1,0.057,18945,13,0.028
78,115040,12/3/2025,DVP / DVP N Lawrence W Ramp / Lawrence Ave E / Lawrence E DVP N Ramp,-79.33208786,43.73949719,2,13451871,,14,41322,16,0.031,14,2025-12-03T07:45:00,3531,1,0.029,2025-12-03T16:15:00,3829,4,0.021,0,0,0,17777,8,0.023,4606,2,0.035,18939,6,0.038
79,115039,12/3/2025,Don River E Branch / DVP N Lawrence E Ramp / Lawrence Ave E,-79.33055472,43.73978987,2,13451827,,14,34698,16,0.04,9,2025-12-03T07:45:00,2939,2,0.037,2025-12-03T17:00:00,3107,2,0.021,1075,0,0.032,18194,10,0.037,0,0,0,15429,6,0.044
80,114935,12/3/2025,Walnut Ave / Stanley Ave,-79.40927165,43.64325568,2,13467824,,14,480,37,0.042,560,2025-12-03T08:30:00,46,4,0.043,2025-12-03T16:30:00,67,5,0.045,1,12,0,91,5,0.055,388,20,0.039,0,0,0
81,115025,12/2/2025,Bathurst St / Lonsdale Rd / Claxton Blvd,-79.41993887,43.68718796,2,13460526,307,14,29350,73,0.03,1425,2025-12-02T08:00:00,2436,5,0.029,2025-12-02T17:15:00,2393,14,0.017,12541,19,0.033,776,14,0.01,12603,23,0.031,3430,17,0.023
82,114580,11/29/2025,St Clair Ave E / Victoria Park Ave (South),-79.29598558,43.70877653,2,13456521,471,14,38227,85,0.021,2829,2025-11-29T09:15:00,2442,7,0.024,2025-11-29T15:45:00,3664,4,0.015,9258,27,0.022,11706,21,0.015,9165,29,0.021,8098,8,0.028
83,114549,11/29/2025,Finch Ave E / Victoria Park Ave,-79.33141242,43.79310646,2,13444318,1015,14,40399,94,0.025,2908,2025-11-29T09:15:00,2728,4,0.022,2025-11-29T14:15:00,3762,6,0.023,6696,24,0.025,13065,32,0.025,6941,20,0.027,13697,18,0.023
84,114550,11/29/2025,Victoria Park Ave / Gordon Baker Rd,-79.33920168,43.81063902,2,13442540,1252,14,16588,18,0.021,193,2025-11-29T09:15:00,1117,0,0.015,2025-11-29T14:30:00,1676,0,0.017,8616,7,0.019,1177,4,0.01,4800,5,0.03,1995,2,0.013
85,114551,11/29/2025,Victoria Park Ave / McNicoll Ave,-79.33631681,43.80408565,2,13443090,569,14,23000,43,0.024,774,2025-11-29T09:15:00,1557,2,0.022,2025-11-29T14:15:00,2247,3,0.02,7637,18,0.026,5916,6,0.015,4773,8,0.039,4674,11,0.016
86,114552,11/29/2025,Sheppard Ave E / Victoria Park Ave,-79.32301711,43.77524462,2,13446551,748,14,50547,64,0.018,10351,2025-11-29T09:15:00,3153,6,0.021,2025-11-29T16:15:00,5001,8,0.014,12639,16,0.014,12074,14,0.023,13412,8,0.014,12422,26,0.021
87,114553,11/29/2025,Victoria Park Ave / Tempo Ave,-79.33735771,43.80639951,2,13442882,1530,14,13889,31,0.021,203,2025-11-29T09:15:00,969,2,0.02,2025-11-29T14:15:00,1333,2,0.021,7808,16,0.013,302,1,0.01,4484,12,0.04,1295,2,0.008
88,114554,11/29/2025,Hwy 401 Collectors E Victoria Pr Ramp / Hwy 401 Collectors W Ramp / Victoria Park Ave / Victoria Pr N,-79.31917966,43.76692508,2,13447751,759,14,42704,50,0.014,80,2025-11-29T09:15:00,3018,5,0.016,2025-11-29T14:00:00,3929,9,0.013,15709,26,0.014,0,0,0,18650,24,0.014,8345,0,0.014
89,114555,11/29/2025,Victoria Park Ave / Clydesdale Dr,-79.32705799,43.7838741,2,13445474,1251,14,16823,13,0.014,245,2025-11-29T09:15:00,1083,1,0.013,2025-11-29T16:00:00,1753,1,0.012,9260,10,0.012,0,0,0,7179,3,0.017,384,0,0.003
90,114556,11/29/2025,Victoria Park Ave / Terraview Blvd / Farm Greenway,-79.31816426,43.76451523,2,13448105,1914,14,40520,69,0.014,393,2025-11-29T09:15:00,2881,6,0.015,2025-11-29T15:00:00,3683,8,0.014,20987,28,0.014,3410,4,0.004,15868,25,0.016,255,12,0.016
91,114557,11/29/2025,Victoria Park Ave / Consumers Rd / Meadowacres Dr,-79.32151095,43.77192576,2,13446996,864,14,37759,51,0.016,1433,2025-11-29T09:15:00,2611,3,0.018,2025-11-29T14:00:00,3690,11,0.014,14586,22,0.017,3660,7,0.007,14901,19,0.017,4612,3,0.018
92,114559,11/29/2025,Victoria Park Ave / York Mills Rd,-79.31753172,43.76302094,2,13448310,518,14,37292,63,0.015,926,2025-11-29T09:15:00,2647,4,0.015,2025-11-29T14:00:00,3403,12,0.012,19877,23,0.014,0,0,0,13268,27,0.018,4147,13,0.006
93,114560,11/29/2025,Victoria Park Ave / Combermere Dr,-79.31461539,43.75606337,2,13449271,2344,14,26912,61,0.014,1842,2025-11-29T09:15:00,1965,3,0.012,2025-11-29T14:00:00,2425,9,0.012,13967,9,0.014,0,10,0,12555,37,0.014,390,5,0.008
94,114561,11/29/2025,Victoria Park Ave / Old Sheppard Ave / Huntingwood Dr,-79.32539531,43.78035202,2,13445899,1085,14,23387,66,0.02,425,2025-11-29T09:15:00,1662,4,0.017,2025-11-29T16:00:00,2379,4,0.017,10213,14,0.021,3137,26,0.013,8771,13,0.023,1266,13,0
95,114562,11/29/2025,Ellesmere Rd / Victoria Park Ave / Parkwoods Village Dr,-79.31524544,43.75786943,2,13449013,517,14,44363,71,0.02,3308,2025-11-29T09:15:00,3072,7,0.021,2025-11-29T15:45:00,4152,5,0.017,13941,14,0.017,10970,11,0.02,11988,19,0.019,7464,27,0.025
96,114563,11/29/2025,Victoria Park Ave / Cassandra Blvd,-79.31401881,43.7543411,2,13449511,512,14,27851,40,0.014,1463,2025-11-29T09:15:00,1986,0,0.015,2025-11-29T14:00:00,2506,2,0.012,13927,15,0.013,0,0,0,11364,14,0.016,2560,11,0.004
97,114564,11/29/2025,Victoria Park Ave / Van Horne Ave / Ferncrest Gt,-79.32958651,43.78925136,2,13444794,994,14,21187,70,0.02,755,2025-11-29T09:15:00,1429,5,0.019,2025-11-29T16:00:00,2228,4,0.016,9757,37,0.02,1340,8,0.001,6950,13,0.028,3140,12,0.013
98,114565,11/29/2025,Victoria Park Ave / Pawnee Ave / Morecambe Gt,-79.33363321,43.79805117,2,13443726,1113,14,12857,35,0.029,400,2025-11-29T09:15:00,899,5,0.021,2025-11-29T14:00:00,1215,5,0.026,6054,12,0.029,1028,9,0.008,4931,12,0.037,844,2,0.008
99,114566,11/29/2025,Victoria Park Ave / Patrick Blvd,-79.3241706,43.77774309,2,13446226,1119,14,21573,34,0.02,911,2025-11-29T09:15:00,1456,5,0.018,2025-11-29T16:00:00,2203,3,0.015,11311,23,0.018,0,0,0,9499,8,0.022,763,3,0.01
100,114567,11/29/2025,Victoria Park Ave / Rowena Dr,-79.31302473,43.75149818,2,13449947,2059,14,24318,41,0.019,963,2025-11-29T09:15:00,1709,0,0.02,2025-11-29T14:00:00,2212,3,0.015,12600,21,0.018,0,2,0,10810,17,0.021,908,1,0.012
101,114568,11/29/2025,Victoria Park Ave / Curlew Dr / Lynvalley Cres,-79.31181482,43.74795324,2,13450472,516,14,25306,42,0.019,647,2025-11-29T09:15:00,1753,3,0.019,2025-11-29T14:00:00,2359,4,0.015,12691,22,0.018,901,1,0.009,9895,16,0.022,1819,3,0.01
102,114569,11/29/2025,Lawrence Ave E / Victoria Park Ave,-79.30979376,43.74214404,2,13451412,407,14,54976,67,0.019,3664,2025-11-29T09:15:00,3467,8,0.023,2025-11-29T14:00:00,5129,5,0.019,11774,18,0.02,17306,20,0.018,11878,18,0.021,14018,11,0.019
103,114570,11/29/2025,Victoria Park Ave / Surrey Ave,-79.30742794,43.73627099,2,13452323,515,14,23565,27,0.02,897,2025-11-29T09:15:00,1403,1,0.019,2025-11-29T16:00:00,2352,1,0.012,11302,15,0.02,1667,2,0.005,10596,10,0.022,0,0,0
104,114571,11/29/2025,Victoria Park Ave / Arncliffe Cres,-79.30561021,43.73186622,2,13453008,1585,14,21813,22,0.014,633,2025-11-29T09:15:00,1278,1,0.014,2025-11-29T16:00:00,2143,0,0.009,11148,12,0.015,349,4,0.006,10233,6,0.014,83,0,0
105,114572,11/29/2025,Victoria Park Ave / Elvaston Dr,-79.30499958,43.73038425,2,13453216,514,14,22621,49,0.02,516,2025-11-29T09:15:00,1277,3,0.019,2025-11-29T16:00:00,2194,0,0.015,11256,26,0.02,0,1,0,10335,13,0.022,1030,9,0.014
106,114573,11/29/2025,Victoria Park Ave / Craigton Dr / Jonesville Cres,-79.30347093,43.72668671,2,13453844,202,14,25453,45,0.022,1346,2025-11-29T09:15:00,1439,2,0.022,2025-11-29T15:15:00,2550,5,0.016,11009,26,0.02,2462,6,0.012,11114,12,0.026,868,1,0.013
107,114574,11/29/2025,Eglinton Ave E / Victoria Park Ave,-79.30264501,43.72472302,2,13454107,451,14,44756,105,0.026,2625,2025-11-29T09:15:00,3028,11,0.027,2025-11-29T15:30:00,4031,10,0.018,9686,18,0.022,10961,32,0.03,9581,22,0.029,14528,33,0.025
108,114575,11/29/2025,Victoria Park Ave / Sunrise Ave,-79.30059256,43.71978583,2,13454774,1581,14,20852,35,0.022,727,2025-11-29T09:15:00,1351,1,0.021,2025-11-29T15:15:00,2056,6,0.017,8812,13,0.023,896,3,0.012,8878,16,0.025,2266,3,0.013
109,114576,11/29/2025,Victoria Park Ave / Eglinton Sq / O'Connor Dr,-79.30210028,43.72338098,2,13454288,449,14,32852,73,0.022,2716,2025-11-29T09:15:00,2084,2,0.024,2025-11-29T14:00:00,3272,12,0.019,11150,21,0.022,4677,12,0.021,9766,21,0.023,7259,19,0.021
110,114577,11/29/2025,Victoria Park Ave / Parma Crt,-79.29928672,43.71667022,2,13455247,519,14,17529,27,0.024,255,2025-11-29T09:15:00,1177,3,0.022,2025-11-29T15:45:00,1678,2,0.016,8708,11,0.024,0,0,0,8576,16,0.025,245,0,0.008
111,114578,11/29/2025,Victoria Park Ave / Bassett Ave / Yardley Ave,-79.29805922,43.71377872,2,13455708,513,14,18385,41,0.023,394,2025-11-29T09:15:00,1210,2,0.024,2025-11-29T15:30:00,1755,6,0.017,8357,12,0.025,443,5,0,8395,18,0.025,1190,6,0.011
112,114579,11/29/2025,Victoria Park Ave / Conroy Ave,-79.29286133,43.70158973,2,13457690,2434,14,11878,47,0.029,521,2025-11-29T09:15:00,804,0,0.032,2025-11-29T15:45:00,1129,3,0.021,5527,21,0.031,398,7,0.008,5953,19,0.028,0,0,0
113,114583,11/29/2025,Victoria Park Ave: Denton Ave - Crescent Town Rd,-79.2893659,43.69368359,1,1185,2149,14,14067,115,0.035,2722,2025-11-29T09:15:00,893,4,0.043,2025-11-29T15:45:00,1324,10,0.03,6868,66,0.024,283,3,0.972,6916,46,0.008,0,0,0
114,114582,11/29/2025,Victoria Park Ave / Dawes Rd (South),-79.29508541,43.70674831,2,13456890,1131,14,21323,82,0.023,956,2025-11-29T09:15:00,1400,3,0.025,2025-11-29T15:30:00,1993,11,0.02,10741,34,0.027,0,1,0,5955,28,0.028,4627,19,0.009
115,114588,11/29/2025,Kingston Rd / Victoria Park Ave,-79.28406044,43.68081144,2,13461342,158,14,18570,236,0.028,4145,2025-11-29T09:15:00,1315,8,0.026,2025-11-29T16:30:00,1626,39,0.021,2952,49,0.043,6808,83,0.026,1919,33,0.01,6891,71,0.029
116,114581,11/29/2025,Victoria Park Ave / Crescent Town Rd,-79.29048449,43.69655055,2,13458442,982,14,16289,111,0.022,722,2025-11-29T09:15:00,1038,6,0.025,2025-11-29T15:30:00,1548,16,0.018,6273,35,0.027,0,2,0,6952,47,0.024,3064,27,0.007
117,114587,11/29/2025,Victoria Park Ave / Gerrard St E,-79.28657658,43.68690495,2,13460223,361,14,25942,201,0.018,1350,2025-11-29T09:15:00,1736,15,0.017,2025-11-29T14:00:00,2509,22,0.014,7314,82,0.021,7390,25,0.012,3935,68,0.035,7303,26,0.011
118,114586,11/29/2025,Victoria Park Ave / Shale Ridge Crt / Musgrave St,-79.28700428,43.68794459,2,13460032,1846,14,20924,273,0.017,2414,2025-11-29T09:15:00,1481,11,0.019,2025-11-29T14:00:00,2042,29,0.015,9167,124,0.019,2057,30,0.004,7243,83,0.023,2457,36,0.004
119,114585,11/29/2025,Danforth Ave / Victoria Park Ave,-79.28835861,43.69123234,2,13459445,355,14,30083,645,0.026,8697,2025-11-29T09:15:00,2077,41,0.024,2025-11-29T14:45:00,2710,66,0.018,6672,76,0.026,8730,292,0.029,7216,112,0.024,7465,165,0.027
120,114584,11/29/2025,Victoria Park Ave / Denton Ave,-79.28902203,43.69286919,2,13459140,1447,14,16247,159,0.032,2518,2025-11-29T09:15:00,998,9,0.041,2025-11-29T15:45:00,1603,14,0.025,7004,66,0.048,2462,28,0.004,6769,55,0.025,12,10,0
121,114548,11/29/2025,Victoria Park Ave: Gordon Baker Rd - Steeles Ave E,-79.34022377,43.81316006,1,11467214,1830,14,13723,27,0.027,69,2025-11-29T09:15:00,960,3,0.023,2025-11-29T14:15:00,1366,3,0.026,8688,15,0.023,0,2,0,4659,9,0.037,376,1,0.011
122,114946,11/25/2025,Eldora Ave / Hendon Ave / Hendon Park Trl,-79.4200264,43.78072682,2,13446027,,14,5640,6,0.009,448,2025-11-25T08:00:00,628,0,0.006,2025-11-25T17:00:00,749,0,0,0,0,0,3028,4,0.009,148,1,0.041,2464,1,0.008
123,114944,11/25/2025,Thistle Down Blvd / Barkwin Dr,-79.55893581,43.73724903,2,13452721,,14,3461,17,0.038,242,2025-11-25T08:15:00,342,1,0.047,2025-11-25T16:45:00,352,0,0.017,750,0,0.023,1384,9,0.041,0,0,0,1327,8,0.042
124,114943,11/25/2025,Thistle Down Blvd,-79.55613052,43.73791556,2,13452614,,14,2276,12,0.045,152,2025-11-25T08:15:00,267,1,0.03,2025-11-25T14:45:00,254,1,0.067,475,1,0.023,737,7,0.053,0,0,0,1064,4,0.05
125,114942,11/25/2025,Maplewood Ave / Kenwood Ave,-79.42339043,43.68593826,2,13460781,,14,1857,46,0.024,408,2025-11-25T08:00:00,232,6,0.043,2025-11-25T17:00:00,175,1,0.017,642,12,0.025,233,5,0.026,367,11,0.03,615,18,0.018
126,114941,11/25/2025,Vaughan Rd / Humewood Dr,-79.42831661,43.68880382,2,13460246,5640,14,13542,103,0.042,679,2025-11-25T07:45:00,1151,12,0.055,2025-11-25T17:00:00,1206,13,0.014,719,16,0.036,5384,36,0.042,443,12,0.034,6996,39,0.044
127,114940,11/25/2025,Kenwood Ave / Louise Ave,-79.42269024,43.6841824,2,13461085,,14,1476,22,0.02,602,2025-11-25T08:00:00,200,1,0.045,2025-11-25T16:30:00,148,1,0.02,659,5,0.023,245,6,0.037,373,8,0.005,199,3,0.02
128,114939,11/25/2025,Vaughan Rd / Kenwood Ave,-79.42364831,43.68760696,2,13460459,1646,14,11188,93,0.042,1383,2025-11-25T07:45:00,911,11,0.057,2025-11-25T17:00:00,949,11,0.012,1660,22,0.02,3860,32,0.05,561,9,0.025,5107,30,0.045
129,114948,11/25/2025,Amaron Ave / Monterrey Dr,-79.57573053,43.7428355,2,13451867,5474,14,1425,4,0.019,427,2025-11-25T08:30:00,202,0,0.02,2025-11-25T15:15:00,232,0,0.026,225,0,0.013,0,0,0,577,2,0.026,623,2,0.014
130,114922,11/25/2025,Dundas St W / Pacific Ave,-79.46858856,43.66545591,2,13464436,187,14,13992,306,0.038,5475,2025-11-25T08:00:00,1319,25,0.049,2025-11-25T17:30:00,1261,34,0.014,1398,46,0.012,4770,87,0.052,1488,53,0.019,6336,120,0.038
131,114920,11/25/2025,St Nicholas St / Charles St W,-79.38705875,43.66854721,2,13463763,,14,4166,331,0.023,7670,2025-11-25T08:45:00,351,22,0.023,2025-11-25T17:15:00,441,36,0.002,149,1,0,3815,224,0.023,195,38,0.036,7,68,0
132,114919,11/25/2025,Balmuto St / Charles St W,-79.38739262,43.66848414,2,13463768,,14,4671,423,0.033,10100,2025-11-25T09:15:00,347,35,0.049,2025-11-25T17:15:00,468,50,0.004,960,62,0.03,3159,215,0.031,0,21,0,552,125,0.051
133,114897,11/22/2025,McCowan Rd / Trudelle St,-79.23929772,43.7405901,2,13451483,,14,6542,67,0.003,1035,2025-11-22T09:15:00,433,4,0.002,2025-11-22T14:15:00,618,8,0.002,704,24,0.003,1813,6,0.002,1955,22,0.003,2070,15,0.003
134,114905,11/22/2025,Kingston Rd / Scarborough Golf Club Rd,-79.20934926,43.74600264,2,13450532,1053,14,36252,52,0.023,744,2025-11-22T09:15:00,2401,4,0.024,2025-11-22T15:15:00,3375,4,0.016,2419,8,0.004,16828,19,0.021,870,3,0.001,16135,22,0.029
135,114903,11/22/2025,Markham Rd / Markanna Dr,-79.21785053,43.74065913,2,13451422,2190,14,10306,17,0.027,758,2025-11-22T09:15:00,583,1,0.033,2025-11-22T17:15:00,1047,1,0.022,5086,6,0.026,0,0,0,4733,9,0.03,487,2,0.004
136,114901,11/22/2025,Markham Rd / Luella St,-79.21967987,43.74499001,2,13450705,,14,17910,19,0.011,1100,2025-11-22T09:15:00,1052,0,0.013,2025-11-22T16:15:00,1704,0,0.007,8622,6,0.013,890,0,0.007,7658,9,0.01,740,4,0.003
137,114900,11/22/2025,Bellamy Rd N / Nelson St,-79.23107352,43.74651857,2,13450508,2052,14,9874,20,0.014,329,2025-11-22T09:15:00,569,1,0.023,2025-11-22T14:15:00,1038,0,0.011,4423,6,0.017,484,2,0.004,4533,11,0.013,434,1,0.007
138,114899,11/22/2025,McCowan Rd / Bridlegrove Dr / McCowan District Park Trl,-79.23634459,43.73441806,2,13975289,2451,14,7446,38,0.015,280,2025-11-22T09:15:00,491,2,0.012,2025-11-22T14:00:00,711,3,0.008,3337,10,0.018,482,2,0.002,3462,11,0.016,165,15,0
139,114896,11/22/2025,Kingston Rd / Eglinton Ave E,-79.21165543,43.74374506,2,13450880,147,14,35991,57,0.022,634,2025-11-22T09:15:00,2284,4,0.025,2025-11-22T16:00:00,3558,8,0.017,18116,22,0.022,0,0,0,11603,19,0.006,6272,16,0.05
140,114894,11/22/2025,Eglinton Ave E / Cedar Dr,-79.21557165,43.74394793,2,13450859,1562,14,15594,29,0.043,2600,2025-11-22T09:15:00,1005,1,0.045,2025-11-22T14:15:00,1455,2,0.034,1070,2,0.006,6098,11,0.052,1042,5,0.005,7384,11,0.045
141,114893,11/22/2025,Eglinton Ave E / Beachell St,-79.22210835,43.74248759,2,13451125,1293,14,19339,57,0.033,2796,2025-11-22T09:15:00,1144,2,0.044,2025-11-22T14:15:00,1847,7,0.027,545,3,0.002,9098,16,0.036,1,2,0,9695,36,0.032
142,114892,11/22/2025,Eglinton Ave E / Mason Rd,-79.22516266,43.74179273,2,13451254,638,14,21882,67,0.033,1868,2025-11-22T09:15:00,1286,1,0.044,2025-11-22T14:30:00,2066,6,0.029,1452,8,0.006,8858,29,0.04,2070,3,0.005,9502,27,0.036
143,114891,11/22/2025,Eglinton Ave E / Bellamy Rd N,-79.23205399,43.74026072,2,13451513,191,14,25916,75,0.029,2377,2025-11-22T09:15:00,1498,2,0.039,2025-11-22T14:30:00,2474,5,0.029,4115,23,0.013,9777,22,0.031,534,12,0.011,11490,18,0.035
144,114889,11/22/2025,Eglinton Ave E / Torrance Rd,-79.23525653,43.73953005,2,13451634,1825,14,25104,72,0.032,766,2025-11-22T09:15:00,1509,6,0.041,2025-11-22T14:00:00,2415,9,0.024,886,1,0.008,11018,37,0.036,1914,3,0.005,11286,31,0.035
145,114888,11/22/2025,Eglinton Ave E / Barbados Blvd,-79.24156624,43.73813123,2,13451873,2475,14,25753,106,0.027,786,2025-11-22T09:15:00,1671,5,0.032,2025-11-22T14:45:00,2441,6,0.023,145,5,0.007,12900,53,0.027,491,3,0.016,12217,45,0.028
146,114886,11/22/2025,Eglinton Ave E / Falmouth Ave / Gilder Dr,-79.25317803,43.73561319,2,13452308,217,14,23304,74,0.043,2138,2025-11-22T09:15:00,1494,2,0.051,2025-11-22T15:00:00,2170,11,0.04,888,9,0.006,10781,28,0.046,1558,12,0.003,10077,25,0.049
147,114878,11/19/2025,Victoria Park Ave / Hare Gt,-79.3326936,43.79596639,2,13443978,,14,15881,30,0.054,564,2025-11-19T08:30:00,1920,0,0.045,2025-11-19T17:15:00,1529,2,0.033,8508,18,0.052,0,0,0,6970,12,0.059,403,0,0.007
148,113715,11/19/2025,Front St E / Sherbourne St / Lower Sherbourne St,-79.36789246,43.65039473,2,13466633,253,14,18182,1453,0.051,13076,2025-11-19T08:15:00,1455,132,0.06,2025-11-19T17:00:00,1700,166,0.029,2879,525,0.083,5289,220,0.043,4913,472,0.053,5101,236,0.042
149,114884,11/19/2025,St Clair Ave E / Presley Ave,-79.28850336,43.71041294,2,13456233,,14,25699,44,0.029,332,2025-11-19T08:00:00,2103,4,0.034,2025-11-19T15:45:00,2638,6,0.027,190,0,0.021,12966,21,0.028,187,2,0.027,12356,21,0.031
150,114882,11/19/2025,Marlee Ave / Stayner Ave,-79.44238837,43.70548565,2,13457385,,14,13386,138,0.028,1700,2025-11-19T08:00:00,1210,14,0.03,2025-11-19T16:15:00,1203,25,0.026,6524,65,0.029,145,0,0.014,6269,72,0.026,448,1,0.033
151,114887,11/18/2025,Brimley Rd / Eglinton Ave E,-79.24808459,43.73669646,2,13452119,462,14,41978,149,0.046,3655,2025-11-18T08:00:00,3115,9,0.059,2025-11-18T17:00:00,4315,10,0.027,10464,36,0.025,12178,53,0.055,7212,26,0.041,12124,34,0.059
152,114306,11/18/2025,Horner Ave / Judson St,-79.51582542,43.61208481,2,13470130,,14,10940,29,0.101,83,2025-11-18T08:15:00,963,2,0.134,2025-11-18T16:15:00,963,5,0.059,4818,5,0.11,1863,15,0.101,4259,9,0.092,0,0,0
153,114911,11/18/2025,Martin Grove Rd / Enterprise Rd,-79.57313362,43.6965303,2,13459188,,14,20247,11,0.106,132,2025-11-18T07:45:00,1751,1,0.103,2025-11-18T15:30:00,1749,1,0.075,11006,5,0.119,1617,0,0.125,7624,6,0.082,0,0,0
154,114312,11/18/2025,Aldercrest Rd / Valermo Dr,-79.5415509,43.60730718,2,13470266,,14,2488,35,0.03,297,2025-11-18T07:45:00,341,7,0.044,2025-11-18T16:30:00,240,8,0.004,232,5,0.034,1040,16,0.026,160,5,0.056,1056,9,0.028
155,114314,11/18/2025,Horner Ave / Thirtieth St,-79.53373857,43.60426497,2,13470350,1018,14,16765,83,0.093,411,2025-11-18T08:00:00,1697,3,0.114,2025-11-18T16:15:00,1640,10,0.046,1370,18,0.043,5230,17,0.125,4309,31,0.066,5856,17,0.097
156,114746,11/15/2025,Sheppard Ave E / Leslie St / Don River E Branch,-79.36415836,43.77165891,2,13447128,744,14,46523,27,0.007,645,2025-11-15T09:15:00,3928,2,0.011,2025-11-15T16:00:00,4166,0,0.005,11032,12,0.006,9608,4,0.007,11071,2,0.007,14812,9,0.007
157,114748,11/15/2025,Sheppard Ave E / Shaughnessy Blvd,-79.35332345,43.77372961,2,13446814,745,14,27592,6,0.008,238,2025-11-15T09:15:00,1922,1,0.014,2025-11-15T17:15:00,2579,0,0.005,2424,0,0.005,9275,2,0.01,1135,4,0.003,14758,0,0.009
158,114747,11/15/2025,Sheppard Ave E / Buchan Crt,-79.35866562,43.77257254,2,13446985,1517,14,27387,19,0.005,314,2025-11-15T09:15:00,1729,0,0.011,2025-11-15T16:00:00,2651,2,0.003,998,1,0.002,11310,9,0.007,286,2,0,14793,7,0.004
159,114745,11/15/2025,Sheppard Ave E / Ambrose Rd / Provost Dr / Ambrose Parkette Trl,-79.37133613,43.77034448,2,13447350,1014,14,35214,4,0.005,808,2025-11-15T09:15:00,2640,0,0.008,2025-11-15T14:00:00,3340,0,0.005,2668,0,0.001,12835,4,0.005,4861,0,0.003,14850,0,0.006
160,114744,11/15/2025,Sheppard Ave E / Blue Ridge Rd / Billes Hts,-79.37419981,43.76971373,2,13447460,1956,14,28920,32,0.007,1108,2025-11-15T09:15:00,2258,2,0.012,2025-11-15T14:00:00,2700,2,0.007,829,1,0.004,11494,16,0.007,1108,0,0.001,15489,15,0.007
161,114743,11/15/2025,Sheppard Ave E / Bessarion Rd / Burbank Dr,-79.37664867,43.76919944,2,13447531,743,14,30195,35,0.006,1205,2025-11-15T09:15:00,2337,0,0.01,2025-11-15T15:00:00,2727,3,0.003,2684,6,0.002,12297,18,0.005,578,1,0.003,14636,10,0.007
162,114742,11/15/2025,Sheppard Ave E / Wilfred Ave,-79.39470009,43.76509895,2,13448166,1245,14,26533,42,0.006,439,2025-11-15T09:15:00,1828,0,0.009,2025-11-15T14:00:00,2438,2,0.006,1308,9,0.002,10556,18,0.006,349,4,0,14320,11,0.005
163,114741,11/15/2025,Sheppard Ave E / Willowdale Ave,-79.3996874,43.76399647,2,13448338,741,14,31285,67,0.008,1412,2025-11-15T09:15:00,2141,11,0.011,2025-11-15T16:30:00,2863,6,0.006,4330,9,0.009,10397,20,0.005,1052,10,0.004,15506,28,0.009
164,114740,11/15/2025,Sheppard Ave E / Kenneth Ave / Leona Dr,-79.40475817,43.76288874,2,13448501,1631,14,28887,59,0.009,1082,2025-11-15T09:15:00,1917,7,0.011,2025-11-15T15:15:00,2737,2,0.006,989,8,0.005,11282,31,0.009,47,3,0,16569,17,0.008
165,114739,11/15/2025,Sheppard Ave E / Doris Ave,-79.40826431,43.76210179,2,13448605,1200,14,32327,53,0.008,2359,2025-11-15T09:15:00,2161,5,0.01,2025-11-15T14:00:00,3181,2,0.006,7363,11,0.002,10782,36,0.009,0,0,0,14182,6,0.009
166,114738,11/15/2025,Sheppard Ave W / Pewter Rd,-79.41876314,43.75978937,2,13448953,2563,14,19236,14,0.02,283,2025-11-15T09:15:00,1194,2,0.023,2025-11-15T17:15:00,2017,0,0.013,0,0,0,7836,10,0.025,1144,0,0.003,10256,4,0.018
167,114737,11/15/2025,Sheppard Ave W / Senlac Rd (East),-79.42255963,43.75895044,2,13449067,740,14,20097,21,0.021,408,2025-11-15T09:15:00,1223,1,0.025,2025-11-15T16:00:00,2050,1,0.018,2987,1,0.016,8166,12,0.026,0,1,0,8944,7,0.02
168,114736,11/15/2025,Sheppard Ave W / Easton Rd,-79.42573778,43.75821896,2,13449194,1662,14,18341,11,0.016,454,2025-11-15T09:15:00,1050,2,0.018,2025-11-15T16:45:00,1919,0,0.011,149,1,0,7068,6,0.02,1173,0,0.003,9951,4,0.016
169,114735,11/15/2025,Bathurst St / Sheppard Ave W,-79.43848165,43.75545842,2,13449607,672,14,41180,47,0.014,2900,2025-11-15T09:15:00,2541,5,0.019,2025-11-15T16:00:00,3994,3,0.01,11888,3,0.011,8313,6,0.018,10109,28,0.013,10870,10,0.015
170,114734,11/15/2025,Sheppard Ave W / Yeomans Rd / Bryant St,-79.44342434,43.75449433,2,13449763,2243,14,22218,41,0.014,1064,2025-11-15T09:15:00,1371,8,0.014,2025-11-15T15:30:00,2264,1,0.013,797,12,0.003,9039,17,0.018,1175,7,0,11207,5,0.014
171,114733,11/15/2025,Sheppard Ave W / Goddard St,-79.44805781,43.75351967,2,13449931,1665,14,21188,29,0.016,515,2025-11-15T09:15:00,1336,2,0.015,2025-11-15T15:30:00,2157,2,0.015,679,16,0.007,9281,9,0.019,246,0,0,10982,4,0.015
172,114732,11/15/2025,Sheppard Ave W / Faywood Blvd / Wilmington Ave,-79.45191858,43.75268837,2,13450069,739,14,26094,45,0.014,1163,2025-11-15T09:15:00,1578,5,0.018,2025-11-15T15:30:00,2640,2,0.011,3122,17,0.012,10288,14,0.013,2453,9,0.016,10231,5,0.015
173,114731,11/15/2025,Sheppard Ave W / Wilson Heights Blvd,-79.45675118,43.75166315,2,13450231,631,14,32758,45,0.015,1059,2025-11-15T09:15:00,2097,6,0.014,2025-11-15T15:30:00,3118,1,0.013,4983,3,0.01,9613,14,0.017,10848,16,0.006,7314,12,0.028
174,114729,11/15/2025,Sheppard Ave W / Yukon Lane / Kodiak Cres,-79.46721983,43.75192448,2,13450205,1523,14,27582,18,0.033,403,2025-11-15T09:15:00,2009,0,0.032,2025-11-15T14:00:00,2471,2,0.027,14143,5,0.031,867,2,0.037,12388,9,0.034,184,2,0.087
175,114728,11/15/2025,Sheppard Ave W / Chesswood Dr,-79.47425931,43.75552926,2,13449668,1049,14,32547,33,0.025,479,2025-11-15T09:15:00,2432,0,0.025,2025-11-15T14:00:00,2917,3,0.022,5146,6,0.029,12348,9,0.026,3331,7,0.005,11722,11,0.028
176,114727,11/15/2025,Sheppard Ave W / Bakersfield St / Vitti St,-79.48025029,43.75431599,2,13449875,2287,14,25051,10,0.031,598,2025-11-15T09:15:00,1759,0,0.029,2025-11-15T14:45:00,2283,1,0.026,2869,1,0.01,10580,6,0.036,555,3,0,11047,0,0.034
177,114726,11/15/2025,Sheppard Ave W / Tuscan Gt,-79.48270081,43.75283996,2,13450103,1216,14,24013,9,0.03,565,2025-11-15T09:15:00,1681,0,0.029,2025-11-15T14:00:00,2265,2,0.025,8484,5,0.038,2788,0,0.001,10744,0,0.03,1997,4,0.031
178,114725,11/15/2025,Sheppard Ave W / John Drury Dr,-79.48273843,43.74827455,2,13450779,1296,14,24354,7,0.021,196,2025-11-15T09:15:00,1676,0,0.02,2025-11-15T14:00:00,2272,1,0.019,8615,1,0.029,3087,0,0.006,12652,6,0.02,0,0,0
179,114724,11/15/2025,Keele St / Sheppard Ave W / Downsview Park Trl,-79.48645243,43.74477751,2,13451388,600,14,46417,57,0.025,2485,2025-11-15T09:15:00,3241,1,0.026,2025-11-15T15:00:00,4048,3,0.021,11383,23,0.023,9731,13,0.033,13951,21,0.017,11352,0,0.029
180,114721,11/15/2025,Sheppard Ave W / Sentinel Rd / Sunfield Park Trl,-79.49181112,43.74365673,2,13451553,1427,14,26887,44,0.027,741,2025-11-15T09:15:00,1727,1,0.029,2025-11-15T17:15:00,2524,0,0.024,3162,6,0.03,10345,14,0.031,0,10,0,13380,14,0.023
181,114719,11/15/2025,Sheppard Ave W / Black Creek Trl / Downsview Dells Park Trl,-79.49647734,43.74263423,2,30007061,2499,14,25332,38,0.024,163,2025-11-15T09:15:00,1593,2,0.026,2025-11-15T16:45:00,2396,0,0.019,1,2,0,11832,14,0.025,86,5,0,13413,17,0.023
182,114718,11/15/2025,Sheppard Ave W / Arleta Ave / Northover St,-79.50150193,43.74150031,2,13451923,1010,14,27614,26,0.021,539,2025-11-15T09:15:00,1718,0,0.022,2025-11-15T17:30:00,2604,0,0.018,3138,4,0.023,11851,9,0.023,1267,4,0.002,11358,9,0.021
183,114717,11/15/2025,Sheppard Ave W / Buckland Rd,-79.50340118,43.74107646,2,13451999,,14,21760,20,0.022,261,2025-11-15T09:15:00,1301,0,0.025,2025-11-15T17:15:00,2133,0,0.019,0,2,0,10252,12,0.021,431,0,0.002,11077,6,0.024
184,114716,11/15/2025,Sheppard Ave W / Magellan Dr,-79.50968105,43.73967268,2,13452238,2262,14,21899,45,0.023,539,2025-11-15T09:15:00,1298,1,0.026,2025-11-15T17:15:00,2123,0,0.021,92,4,0.011,9931,28,0.022,862,2,0.005,11014,11,0.025
185,114715,11/15/2025,Jane St / Sheppard Ave W,-79.51322103,43.73938933,2,13452283,533,14,31337,80,0.029,3086,2025-11-15T09:15:00,2086,7,0.03,2025-11-15T16:00:00,3122,4,0.02,7411,25,0.033,7777,30,0.026,7506,15,0.031,8643,10,0.026
186,114714,11/15/2025,Sheppard Ave W / Min Ave / Yatescastle Dr,-79.50688547,43.74032437,2,13452124,1248,14,22452,29,0.02,380,2025-11-15T09:15:00,1358,0,0.022,2025-11-15T17:15:00,2192,0,0.017,1270,7,0.002,10007,16,0.02,260,1,0.015,10915,5,0.023
187,114711,11/15/2025,Sheppard Ave W / Laura Rd,-79.52013438,43.73780667,2,13452551,2289,14,24280,28,0.024,284,2025-11-15T09:15:00,1499,1,0.027,2025-11-15T17:15:00,2380,0,0.018,1621,0,0.004,10884,26,0.029,0,0,0,11775,2,0.023
188,114710,11/15/2025,Sheppard Ave W / Oakdale Rd,-79.52379905,43.73696503,2,13452693,1247,14,29587,34,0.019,147,2025-11-15T09:15:00,1876,3,0.02,2025-11-15T17:15:00,2827,0,0.016,4623,3,0.008,12073,29,0.024,0,0,0,12891,2,0.019
189,114709,11/15/2025,Sheppard Ave W / Arrow Rd,-79.5292781,43.73571343,2,13452894,861,14,29466,30,0.022,132,2025-11-15T09:15:00,1847,1,0.021,2025-11-15T17:15:00,2814,1,0.016,4109,1,0.031,12690,27,0.022,150,0,0.053,12517,2,0.018
190,114708,11/15/2025,Sheppard Ave W / Rivalda Rd / Abraham Welsh Rd,-79.53395523,43.73467084,2,13453059,1128,14,27818,23,0.022,817,2025-11-15T09:15:00,1777,1,0.024,2025-11-15T14:00:00,2590,3,0.024,2756,2,0.062,12003,10,0.024,2485,4,0.004,10574,7,0.014
191,114707,11/15/2025,Weston Rd / Sheppard Ave W,-79.53822885,43.73374681,2,13453198,588,14,33188,15,0.022,430,2025-11-15T09:15:00,2063,1,0.023,2025-11-15T17:30:00,3139,2,0.015,9939,7,0.022,9534,3,0.024,13715,5,0.022,0,0,0
192,114623,11/15/2025,Finch Ave W / Westmore Dr,-79.60095803,43.73464473,2,13453185,1459,14,16991,67,0.044,1073,2025-11-15T09:15:00,1014,3,0.052,2025-11-15T14:00:00,1665,6,0.035,2734,7,0.024,6315,19,0.056,1294,16,0.003,6648,25,0.048
193,114620,11/15/2025,Finch Ave W / Milady Rd,-79.56441568,43.74731048,2,13451124,2333,14,18105,22,0.026,517,2025-11-15T09:15:00,1059,2,0.025,2025-11-15T14:45:00,1760,0,0.022,418,0,0.005,8555,12,0.029,865,1,0.012,8267,9,0.026
194,113608,11/13/2025,Birchmount Rd / Danforth Ave,-79.26399927,43.69699362,2,13458312,359,14,19333,94,0.05,563,2025-11-13T08:30:00,1706,10,0.064,2025-11-13T17:00:00,1815,11,0.021,3544,23,0.067,6569,23,0.041,4030,17,0.082,5190,31,0.025
195,114600,11/12/2025,Finch Ave W: Kipling Ave - Albion Rd,-79.58617147,43.74337686,1,906898,2686,14,14575,50,0.055,947,2025-11-12T07:45:00,1087,0,0.063,2025-11-12T16:30:00,1386,5,0.04,0,16,0,7304,21,0.054,697,4,0.049,6574,9,0.057
196,114873,11/11/2025,Tiffield Rd / Nashdene Rd,-79.25885787,43.81759852,2,13442040,,14,3760,5,0.09,54,2025-11-11T08:30:00,286,2,0.105,2025-11-11T16:30:00,393,0,0.046,390,3,0.103,1153,0,0.077,729,0,0.102,1488,2,0.09
197,114870,11/11/2025,Ravenbury Rd / Marowyne Dr / Clareville Cres,-79.36073451,43.77594667,2,13446532,,14,867,3,0.039,143,2025-11-11T08:00:00,99,0,0.101,2025-11-11T14:45:00,88,0,0.045,81,0,0.049,325,1,0.015,118,0,0.059,343,2,0.052
198,114876,11/11/2025,Bellamy Rd N / Porchester Dr,-79.22932044,43.74238281,2,13451162,,14,10593,22,0.025,355,2025-11-11T08:00:00,957,1,0.026,2025-11-11T17:00:00,1102,0,0.012,4176,5,0.03,958,7,0.005,183,6,0.011,5276,4,0.026
199,114864,11/11/2025,Mount Pleasant Rd / Keewatin Ave,-79.39220048,43.71378582,2,13455929,,14,19667,47,0.022,1100,2025-11-11T07:45:00,1922,3,0.018,2025-11-11T16:15:00,1970,5,0.018,8469,24,0.022,316,0,0.016,10259,22,0.021,623,1,0.026
200,114451,11/9/2025,Bathurst St / Davenport Rd,-79.41576647,43.67671734,2,13462422,384,14,26873,84,0.007,591,2025-11-09T09:00:00,1701,5,0.006,2025-11-09T17:30:00,2332,4,0.009,10603,19,0.007,5046,18,0.006,6985,18,0.009,4239,29,0.007
201,114438,11/9/2025,St Clair Ave W / Old Weston Rd,-79.4630176,43.67354428,2,13463080,492,14,20751,56,0.015,1654,2025-11-09T09:15:00,1406,4,0.013,2025-11-09T14:00:00,2415,5,0.017,3828,17,0.022,4159,13,0.002,4332,11,0.024,8432,15,0.012
202,114439,11/9/2025,Old Weston Rd / Davenport Rd,-79.46231743,43.67104265,2,13463482,391,14,11190,52,0.018,296,2025-11-09T09:15:00,764,3,0.018,2025-11-09T14:00:00,1096,6,0.02,4013,22,0.025,5135,18,0.018,2042,12,0.003,0,0,0
203,114440,11/9/2025,Davenport Rd / Osler St (East),-79.45954001,43.67041021,2,13463595,1508,14,10582,64,0.018,443,2025-11-09T09:15:00,704,4,0.016,2025-11-09T14:15:00,1012,1,0.021,297,12,0,4695,18,0.02,818,10,0,4772,24,0.021
204,114450,11/9/2025,Davenport Rd / Christie St / Hillcrest Park Trl,-79.42309376,43.67556172,2,13462648,385,14,15029,163,0.008,751,2025-11-09T09:15:00,1061,18,0.007,2025-11-09T14:15:00,1353,10,0.006,2673,59,0.009,4653,33,0.007,2879,31,0.009,4824,40,0.008
205,114449,11/9/2025,Davenport Rd / Shaw St,-79.42828675,43.6747338,2,13462794,2582,14,9441,156,0.01,432,2025-11-09T09:15:00,688,14,0.007,2025-11-09T14:15:00,829,19,0.012,0,17,0,4069,50,0.009,606,27,0,4766,62,0.011
206,114448,11/9/2025,Davenport Rd / Ossington Ave,-79.43094725,43.67471008,2,13462801,386,14,13230,96,0.019,964,2025-11-09T09:15:00,940,6,0.018,2025-11-09T14:15:00,1156,8,0.017,0,3,0,4613,43,0.008,2722,11,0.032,5895,39,0.022
207,114447,11/9/2025,Davenport Rd / Dovercourt Rd,-79.43463725,43.67429185,2,13462886,2497,14,11675,76,0.014,401,2025-11-09T09:15:00,962,6,0.012,2025-11-09T14:00:00,1073,7,0.012,0,2,0,4977,29,0.015,2422,5,0.019,4276,40,0.01
208,114446,11/9/2025,Dufferin St / Davenport Rd,-79.44099603,43.67299027,2,13463123,388,14,21613,120,0.025,1427,2025-11-09T09:15:00,1589,5,0.02,2025-11-09T14:00:00,1887,9,0.026,6420,22,0.035,4726,32,0.009,5941,15,0.038,4526,51,0.012
209,114445,11/9/2025,Caledonia Park Rd / Davenport Rd / Earlscourt Park Trl,-79.45107597,43.67109517,2,13463441,390,14,14414,56,0.008,487,2025-11-09T09:15:00,1029,6,0.006,2025-11-09T14:15:00,1365,5,0.012,3660,4,0.006,6483,19,0.007,0,5,0,4271,28,0.012
210,114444,11/9/2025,Davenport Rd / Bartlett Ave N,-79.43834733,43.6737084,2,13462990,2647,14,9366,79,0.01,360,2025-11-09T09:15:00,736,4,0.008,2025-11-09T14:00:00,831,5,0.011,0,2,0,4606,31,0.01,325,7,0.003,4435,39,0.01
211,114442,11/9/2025,Davenport Rd / Oakwood Ave,-79.433752,43.67440546,2,13462867,387,14,15346,100,0.026,654,2025-11-09T09:15:00,1178,6,0.023,2025-11-09T14:15:00,1342,6,0.024,4080,17,0.038,5806,35,0.026,0,4,0,5460,44,0.017
212,114441,11/9/2025,Davenport Rd / Laughton Ave,-79.45577285,43.67032636,2,13463602,1022,14,9503,78,0.02,741,2025-11-09T09:15:00,654,3,0.018,2025-11-09T14:00:00,924,13,0.021,666,20,0.003,4440,28,0.022,58,7,0,4339,23,0.022
213,114453,11/9/2025,Spadina Rd / Davenport Rd / Spadina Park Trl,-79.40809472,43.67742577,2,13462293,1023,14,10574,75,0.008,1026,2025-11-09T09:15:00,691,8,0.01,2025-11-09T15:45:00,932,4,0.01,0,1,0,3619,32,0.004,1254,6,0.03,5701,36,0.005
214,114456,11/9/2025,Davenport Rd / Bedford Rd,-79.39984311,43.67437474,2,13462785,381,14,15818,147,0.01,1156,2025-11-09T09:15:00,1028,12,0.012,2025-11-09T14:00:00,1436,8,0.011,777,16,0.082,6773,50,0.009,1324,31,0.002,6944,50,0.005
215,114455,11/9/2025,Avenue Rd / Davenport Rd,-79.39657256,43.67470092,2,13462724,108,14,34963,125,0.005,2118,2025-11-09T09:15:00,2031,7,0.008,2025-11-09T16:15:00,3447,7,0.002,7462,28,0.005,11181,37,0.004,7860,17,0.005,8460,43,0.006
216,114457,11/9/2025,Davenport Rd / Belmont St / New St,-79.39292347,43.67470974,2,13462718,541,14,17352,80,0.006,646,2025-11-09T09:15:00,1073,6,0.007,2025-11-09T14:00:00,1606,8,0.004,9209,40,0.006,2509,2,0.001,5561,31,0.008,73,7,0
217,114458,11/9/2025,Davenport Rd / Bay St,-79.39068656,43.67310627,2,13462968,,14,14137,117,0.011,1498,2025-11-09T09:15:00,816,9,0.017,2025-11-09T14:00:00,1331,9,0.011,0,1,0,4472,32,0.007,3192,39,0.016,6473,45,0.011
218,114459,11/9/2025,Davenport Rd / Yonge St / Church St,-79.38786647,43.67287384,2,13463015,41,14,15446,363,0.014,5493,2025-11-09T09:15:00,905,21,0.007,2025-11-09T14:00:00,1443,23,0.013,3490,129,0.027,5120,50,0.005,2352,136,0.035,4484,48,0.004
219,114454,11/9/2025,Davenport Rd / Dupont St,-79.40257119,43.67579603,2,13462552,382,14,19969,164,0.006,1952,2025-11-09T09:15:00,1337,10,0.007,2025-11-09T14:15:00,1817,5,0.008,4409,56,0.005,2980,18,0.001,5557,51,0.01,7023,39,0.006
220,114460,11/9/2025,Church St / Park Rd,-79.38475925,43.67217626,2,13463129,165,14,13615,109,0.004,1142,2025-11-09T09:00:00,774,4,0.004,2025-11-09T14:00:00,1291,8,0.005,2555,13,0.004,4278,35,0.004,1308,16,0.005,5474,45,0.004
221,114461,11/9/2025,Bloor St E / Church St,-79.38316045,43.67104641,2,13463285,25,14,18705,601,0.009,9254,2025-11-09T09:00:00,1403,51,0.006,2025-11-09T18:00:00,1583,46,0.003,3859,52,0.004,6979,230,0.011,3266,60,0.005,4601,259,0.012
222,114452,11/9/2025,Walmer Rd / Davenport Rd / Kendal Ave,-79.41036639,43.67683989,2,13462390,383,14,16597,86,0.007,642,2025-11-09T09:15:00,982,9,0.007,2025-11-09T15:00:00,1661,1,0.006,2900,12,0.004,4840,29,0.011,1984,6,0.003,6873,39,0.005
223,114625,11/8/2025,Weston Rd / Finch Ave W,-79.54238057,43.75209,2,13450342,589,14,37890,183,0.034,3007,2025-11-08T09:15:00,2591,12,0.042,2025-11-08T14:00:00,3366,7,0.025,8044,48,0.042,11745,24,0.032,8890,36,0.033,9211,75,0.031
224,114638,11/8/2025,Keele St / Finch Ave W,-79.49105341,43.76350216,2,13448570,601,14,36420,238,0.033,3438,2025-11-08T09:15:00,2425,10,0.034,2025-11-08T15:45:00,3345,14,0.026,9662,72,0.042,7524,38,0.027,9601,65,0.025,9633,63,0.036
225,114637,11/8/2025,Finch Ave W / Romfield Lane,-79.49364246,43.76260098,2,13448693,1061,14,17816,82,0.038,538,2025-11-08T09:00:00,1213,4,0.031,2025-11-08T15:45:00,1644,7,0.026,526,0,0.004,7348,34,0.044,295,0,0.017,9647,48,0.036
226,114636,11/8/2025,Finch Ave W / Sentinel Rd,-79.50000423,43.7610632,2,13448931,808,14,30528,171,0.028,2629,2025-11-08T09:15:00,1957,6,0.026,2025-11-08T16:15:00,2874,12,0.019,5979,37,0.016,7475,29,0.045,4224,40,0.017,12850,65,0.028
227,114635,11/8/2025,Finch Ave W / Black Creek Trl (East),-79.50335228,43.76030884,2,30016928,1750,14,24969,166,0.029,1486,2025-11-08T09:15:00,1602,4,0.029,2025-11-08T16:15:00,2345,16,0.019,0,14,0,11776,77,0.029,0,0,0,13193,75,0.028
228,114634,11/8/2025,Finch Ave W / Tobermory Dr,-79.50790484,43.75929088,2,13449201,1002,14,25288,175,0.027,1386,2025-11-08T09:15:00,1648,7,0.025,2025-11-08T16:00:00,2298,14,0.018,1506,13,0.003,11541,61,0.029,0,15,0,12241,86,0.029
229,114633,11/8/2025,Finch Ave W / Driftwood Ave,-79.51340955,43.75806725,2,13449373,961,14,27901,183,0.031,2422,2025-11-08T09:15:00,1847,7,0.03,2025-11-08T16:15:00,2578,13,0.022,2088,35,0.036,10940,32,0.031,3609,31,0.026,11264,85,0.031
230,114632,11/8/2025,Jane St / Finch Ave W,-79.51769071,43.75726382,2,13449500,534,14,42668,353,0.031,8856,2025-11-08T09:15:00,2863,17,0.031,2025-11-08T15:00:00,3884,39,0.028,8733,88,0.03,10504,54,0.031,9746,88,0.027,13685,123,0.033
231,114631,11/8/2025,Finch Ave W / York Gate Blvd / Elana Dr,-79.52067274,43.75674431,2,13449584,1590,14,34328,166,0.026,2041,2025-11-08T09:15:00,2376,4,0.027,2025-11-08T15:00:00,3036,21,0.022,3859,23,0.006,11918,31,0.031,1711,30,0.008,16840,82,0.028
232,114630,11/8/2025,Finch Ave W / Oakdale Rd / Norfinch Dr,-79.5242871,43.75592856,2,13449708,870,14,45408,160,0.023,1410,2025-11-08T09:15:00,3266,8,0.028,2025-11-08T15:15:00,3981,15,0.021,3906,28,0.014,16262,17,0.024,5676,33,0.014,19564,82,0.026
233,114629,11/8/2025,Finch Ave / Finch Ave W / Hwy 400 N Finch Ave Ramp / Hwy 400 N Ramp,-79.52855709,43.75491954,2,13449874,809,14,40527,106,0.031,42,2025-11-08T09:15:00,2835,4,0.036,2025-11-08T15:00:00,3592,15,0.027,0,0,0,11203,0,0.029,11150,0,0.037,18174,106,0.029
234,114628,11/8/2025,Finch Ave W / Hwy 400 S Finch Ave Ramp,-79.53276608,43.75402933,2,13450029,1095,14,38518,1,0.037,1,2025-11-08T09:15:00,2654,0,0.046,2025-11-08T15:00:00,3463,0,0.03,13819,0,0.02,9883,1,0.049,0,0,0,14816,0,0.046
235,114627,11/8/2025,Finch Ave W / Rumike Rd / Milvan Dr,-79.55228821,43.74995672,2,13450665,811,14,25547,98,0.024,2115,2025-11-08T09:15:00,1761,4,0.028,2025-11-08T14:00:00,2300,10,0.014,4027,11,0.02,10540,26,0.027,2185,10,0.011,8795,51,0.026
236,114626,11/8/2025,Finch Ave W / Arrow Rd / Signet Dr,-79.53623117,43.75329968,2,13450142,810,14,37400,117,0.041,336,2025-11-08T09:15:00,2620,5,0.053,2025-11-08T14:00:00,3294,7,0.028,5058,7,0.045,16499,2,0.039,4943,12,0.06,10900,96,0.034
237,114624,11/8/2025,Finch Ave W / Jayzel Dr,-79.54910467,43.75064407,2,13450552,1663,14,21598,98,0.027,871,2025-11-08T09:15:00,1516,5,0.034,2025-11-08T14:00:00,1870,4,0.016,469,10,0.015,10687,41,0.028,2116,1,0.007,8326,46,0.033
238,114622,11/8/2025,Finch Ave W / Ardwick Blvd / Duncanwoods Dr,-79.55763316,43.74879491,2,13450852,960,14,19720,100,0.025,1272,2025-11-08T09:15:00,1278,7,0.029,2025-11-08T14:00:00,1840,16,0.016,1194,10,0.006,9462,37,0.026,914,23,0.011,8150,30,0.028
239,114621,11/8/2025,Finch Ave W / Ardwick Blvd / Pearldale Ave,-79.56234322,43.74777096,2,13451044,1223,14,19639,69,0.025,1731,2025-11-08T09:15:00,1213,6,0.029,2025-11-08T14:00:00,1852,9,0.016,1563,14,0.012,8345,21,0.028,962,9,0.005,8769,25,0.026
240,114619,11/8/2025,Kipling Ave / Finch Ave W / Kipling Ave Bicycle Trl,-79.58211604,43.7432636,2,13451819,1570,14,32939,171,0.022,3429,2025-11-08T09:15:00,2034,8,0.022,2025-11-08T14:00:00,3078,20,0.018,10363,57,0.014,7780,26,0.03,8023,47,0.018,6773,41,0.029
241,114618,11/8/2025,Finch Ave W / Humber College Blvd,-79.60991305,43.73409713,2,13453266,1496,14,20112,63,0.061,2632,2025-11-08T09:15:00,1242,1,0.068,2025-11-08T14:00:00,1841,8,0.05,2328,15,0.026,6355,16,0.076,2339,10,0.162,9090,22,0.034
242,114617,11/8/2025,Finch Ave W / John Garland Blvd / Silverstone Dr,-79.59495623,43.73601709,2,13452977,1224,14,15844,73,0.044,527,2025-11-08T09:15:00,942,4,0.051,2025-11-08T14:15:00,1598,15,0.036,1066,6,0.003,6288,26,0.051,1852,5,0.04,6638,36,0.046
243,114616,11/8/2025,Islington Ave / Finch Ave W / Humber River E Branch,-79.56862109,43.7462477,2,13451305,947,14,33651,85,0.02,1226,2025-11-08T09:15:00,2148,7,0.022,2025-11-08T15:45:00,3139,13,0.015,7979,22,0.014,9420,13,0.026,8177,13,0.012,8075,37,0.027
244,114615,11/8/2025,Finch Ave W / Woodbine Downs Blvd / Halesia Dr,-79.60671808,43.73372214,2,13453318,1848,14,15848,44,0.054,1345,2025-11-08T09:15:00,962,1,0.06,2025-11-08T14:15:00,1546,5,0.043,1912,4,0.03,5713,22,0.076,862,7,0.002,7361,11,0.049
245,114614,11/8/2025,Martin Grove Rd / Finch Ave W,-79.59165411,43.73678616,2,13452853,992,14,22889,115,0.034,1187,2025-11-08T09:15:00,1420,5,0.042,2025-11-08T14:15:00,2195,20,0.031,4791,18,0.035,5260,31,0.039,5930,19,0.016,6908,47,0.045
246,114612,11/8/2025,Finch Ave W / Hwy 27 N,-79.60308784,43.73416912,2,13453246,1163,14,31032,131,0.036,909,2025-11-08T09:15:00,1857,7,0.046,2025-11-08T14:15:00,3105,27,0.03,8650,30,0.019,7218,41,0.054,9136,30,0.024,6028,30,0.057
247,114611,11/8/2025,Finch Ave W / Humberline Dr,-79.61787738,43.73503865,2,13453152,1506,14,27521,32,0.057,444,2025-11-08T09:15:00,1563,1,0.072,2025-11-08T14:00:00,2598,6,0.055,3926,10,0.123,8069,6,0.041,4272,10,0.034,11254,6,0.055
248,114752,11/5/2025,Danforth Ave / Leyton Ave (East),-79.27785787,43.69354238,2,13458980,,14,17146,262,0.042,659,2025-11-05T08:00:00,1500,15,0.048,2025-11-05T16:00:00,1471,39,0.035,262,11,0.031,8521,154,0.041,158,5,0.032,8205,92,0.044
249,114761,11/5/2025,Sheppard Ave E / Massie St,-79.24520876,43.79253403,2,13444211,,14,16733,38,0.043,309,2025-11-05T08:30:00,1300,1,0.044,2025-11-05T17:00:00,1515,3,0.024,7793,11,0.048,131,1,0.023,504,12,0.028,8305,14,0.039
250,114756,11/5/2025,Kingston Rd / Blantyre Ave (West),-79.281474,43.68142026,2,13461226,,14,19963,122,0.041,1354,2025-11-05T07:45:00,1919,10,0.044,2025-11-05T16:15:00,2042,15,0.028,990,7,0.013,8948,61,0.041,980,7,0.029,9045,47,0.045
251,113762,11/5/2025,Lake Shore Blvd W / Superior Ave,-79.48865682,43.61496181,2,13470022,231,14,14817,34,0.04,2311,2025-11-05T08:00:00,1341,3,0.043,2025-11-05T17:00:00,1493,3,0.018,1672,4,0.022,7100,11,0.043,684,8,0.029,5361,11,0.043
252,114284,11/5/2025,Eastern Ave / Morse St,-79.34017268,43.65811508,2,13465314,5341,14,14010,161,0.054,818,2025-11-05T09:00:00,1068,11,0.065,2025-11-05T16:15:00,1296,22,0.025,4,9,0,6810,86,0.054,544,32,0.07,6652,34,0.052
253,114825,11/4/2025,Burnhamthorpe Rd / Kipling Ave,-79.53939541,43.65097796,2,13466915,726,14,29942,82,0.047,510,2025-11-04T07:00:00,2448,8,0.05,2025-11-04T16:45:00,3054,11,0.024,6950,18,0.065,5913,31,0.042,8377,10,0.048,8702,23,0.034
254,114828,11/4/2025,Brimwood Blvd / Amanda Dr,-79.27567782,43.81292296,2,13442278,5230,14,5195,56,0.016,918,2025-11-04T08:00:00,547,3,0.029,2025-11-04T14:45:00,1005,4,0.014,157,2,0.064,2446,29,0.014,0,0,0,2592,25,0.014
255,114829,11/4/2025,Brimwood Blvd / Delburn Dr,-79.27353234,43.81241611,2,13442308,5231,14,3497,50,0.011,1133,2025-11-04T08:00:00,409,5,0.027,2025-11-04T14:45:00,386,10,0.023,1625,17,0.012,205,5,0.005,1667,28,0.011,0,0,0
256,114830,11/4/2025,White Heather Blvd / Dragoon Cres,-79.26650737,43.81312921,2,13442259,,14,2690,29,0.023,1165,2025-11-04T08:00:00,332,5,0.009,2025-11-04T15:15:00,385,5,0.026,1239,17,0.022,0,0,0,1273,11,0.017,178,1,0.073
257,114831,11/4/2025,Briarscross Blvd / Chartland Blvd S,-79.26979123,43.80322707,2,13443082,5262,14,2753,61,0.026,729,2025-11-04T08:00:00,363,9,0.055,2025-11-04T14:30:00,274,5,0.073,1045,27,0.018,9,0,0.111,1285,28,0.033,414,6,0.024
258,114832,11/4/2025,Kenhatch Blvd / Sandhurst Crcl,-79.26378654,43.80558935,2,13442861,,14,3223,16,0.016,314,2025-11-04T08:00:00,363,3,0.047,2025-11-04T16:30:00,308,2,0.003,0,0,0,1124,2,0.007,764,7,0.014,1335,7,0.024
259,114837,11/4/2025,Don Mills Rd / Gateway Blvd / West Don River Trl,-79.336351,43.7144037,2,13455700,1389,14,29752,183,0.041,2401,2025-11-04T07:30:00,3385,16,0.037,2025-11-04T17:45:00,3025,9,0.021,12388,69,0.044,3150,20,0.062,13932,88,0.031,282,6,0.106
260,114838,11/4/2025,Eglinton E Ferrand Dr Ramp / Ferrand Dr,-79.33561989,43.72112661,2,13454666,,14,1395,53,0.015,232,2025-11-04T09:00:00,154,2,0.019,2025-11-04T17:45:00,172,4,0.006,1207,24,0.012,186,19,0.038,0,0,0,2,10,0
261,114839,11/4/2025,Spadina Ave / Fort York Blvd / Bremner Blvd,-79.39300461,43.64056282,2,13468134,1579,14,33975,977,0.04,12245,2025-11-04T08:30:00,3015,87,0.046,2025-11-04T18:45:00,2780,107,0.017,11848,231,0.047,4318,309,0.028,13927,73,0.04,3882,364,0.031
262,114841,11/4/2025,Dundas St E / Broadview Ave,-79.35135256,43.66244836,2,13464658,292,14,17055,3071,0.039,4991,2025-11-04T08:15:00,1473,441,0.047,2025-11-04T17:15:00,1480,422,0.02,3471,333,0.053,6274,1307,0.025,3141,282,0.065,4169,1149,0.028
263,114842,11/4/2025,The Pond Rd / Sentinel Rd / Scholars Walk,-79.50249285,43.77001129,2,13447680,2078,14,13094,233,0.035,8831,2025-11-04T08:00:00,1036,14,0.036,2025-11-04T16:00:00,1293,21,0.028,829,45,0.008,3656,43,0.04,3653,73,0.05,4956,72,0.025
264,114843,11/4/2025,Dundas St E / Munro St,-79.35304714,43.66205131,2,13464720,1117,14,10936,2519,0.021,1895,2025-11-04T08:00:00,895,428,0.035,2025-11-04T17:00:00,931,367,0.009,1,49,0,6289,1283,0.02,264,43,0.049,4382,1144,0.021
265,114847,11/4/2025,Elinor Ave / Joy Dr,-79.30349421,43.75145885,2,13449932,,14,984,6,0.047,52,2025-11-04T09:15:00,143,0,0.105,2025-11-04T16:00:00,130,2,0.054,320,1,0.056,382,2,0.037,282,3,0.05,0,0,0
266,114848,11/4/2025,Hwy 401 Collectors E Leslie St Ramp / Hwy 401 Collectors E Ramp / Leslie N / Leslie St / Lesmill Rd,-79.36191927,43.76374386,2,13448296,754,14,56383,47,0.023,127,2025-11-04T08:15:00,5769,1,0.028,2025-11-04T17:15:00,5316,2,0.007,15626,20,0.017,6521,7,0.023,19217,7,0.023,15019,13,0.028
267,114849,11/4/2025,Kipling Ave / Mount Olive Dr / Panorama Crt / Kipling Ave Bicycle Trl,-79.58380727,43.74681421,2,13451253,1254,14,19158,136,0.032,3523,2025-11-04T08:15:00,1559,8,0.04,2025-11-04T17:00:00,1907,24,0.015,7829,42,0.033,2408,29,0.02,6861,51,0.038,2060,14,0.022
268,114850,11/4/2025,Kipling Ave / Rowntree Rd / Annabelle Dr,-79.58582827,43.75097617,2,13450584,1659,14,15863,134,0.037,2187,2025-11-04T08:15:00,1429,15,0.04,2025-11-04T17:00:00,1562,8,0.021,6777,18,0.038,2682,6,0.016,5789,100,0.047,615,10,0.016
269,114840,11/4/2025,Adelaide St E / Church St,-79.37492708,43.65118439,2,13466516,17,14,16499,1842,0.033,14429,2025-11-04T08:00:00,1278,122,0.04,2025-11-04T17:15:00,1614,379,0.013,3061,195,0.037,0,48,0,2734,149,0.046,10704,1450,0.029
270,114758,11/4/2025,Royal York Rd / Judson St,-79.49836749,43.61617394,2,13469989,2498,14,17507,457,0.027,3388,2025-11-04T08:15:00,1465,40,0.03,2025-11-04T17:00:00,1634,46,0.012,5855,177,0.031,0,25,0,7821,211,0.028,3831,44,0.02
271,114751,11/4/2025,Danforth Ave / Sneath Ave,-79.28584935,43.69178587,2,13459349,,14,19427,907,0.039,1673,2025-11-04T08:00:00,1592,37,0.049,2025-11-04T16:45:00,1739,97,0.015,0,11,0,9942,569,0.036,0,1,0,9485,326,0.041
272,114819,11/4/2025,Poplar Plains Rd / Davenport Rd / Macpherson Ave,-79.40297805,43.67680936,2,13462372,,14,13828,924,0.021,921,2025-11-04T07:45:00,1035,110,0.022,2025-11-04T15:00:00,1315,55,0.021,1085,315,0.016,933,34,0.033,5964,342,0.02,5846,233,0.02
273,114822,11/4/2025,Cottingham Rd / Davenport Rd / Glen Edyth Dr,-79.40524887,43.67782373,2,13462201,,14,11438,834,0.028,590,2025-11-04T07:45:00,911,126,0.031,2025-11-04T14:30:00,974,50,0.028,209,11,0.077,1033,134,0.038,4525,248,0.029,5671,441,0.024
274,114398,11/1/2025,Arnall Ave / Pharmacy Ave,-79.3321493,43.80721206,2,13442801,2216,14,9388,43,0.017,138,2025-11-01T09:15:00,565,3,0.018,2025-11-01T16:45:00,949,3,0.017,4894,24,0.018,452,2,0.004,4042,15,0.017,0,2,0
275,114379,10/30/2025,Pharmacy Ave: Huntingdale Blvd - Chester Le Blvd,-79.328435,43.799085,1,14668282,2234,14,7942,12,0.029,99,2025-10-30T08:15:00,1083,3,0.03,2025-10-30T17:00:00,1051,0,0.01,4500,8,0.024,0,1,0,3286,2,0.032,156,1,0.109
276,113574,10/30/2025,Kennedy Rd / Huntingwood Dr,-79.29345136,43.7951508,2,13444019,1111,14,37024,72,0.031,341,2025-10-30T08:15:00,3145,11,0.042,2025-10-30T17:15:00,3463,3,0.016,12611,20,0.034,5906,14,0.026,13553,19,0.032,4954,19,0.028
277,113748,10/30/2025,Burnhamthorpe Rd / The West Mall,-79.56725019,43.64455295,2,13467918,875,14,41923,43,0.028,1770,2025-10-30T08:15:00,3765,7,0.033,2025-10-30T17:00:00,3963,1,0.018,6461,14,0.027,12873,14,0.03,5875,9,0.03,16714,6,0.025
278,113626,10/30/2025,Kipling Ave / The Westway,-79.55470312,43.6856254,2,13461140,730,14,29494,44,0.039,1135,2025-10-30T08:15:00,2828,4,0.052,2025-10-30T15:15:00,2971,10,0.042,8687,4,0.046,6765,19,0.026,9164,10,0.046,4878,11,0.03
279,113662,10/30/2025,Hwy 427 S Ramp / Renforth / Renforth Dr,-79.5905822,43.667685,2,13464341,925,14,35284,19,0.057,12,2025-10-30T08:00:00,3553,0,0.044,2025-10-30T16:45:00,3566,0,0.034,11442,3,0.075,0,0,0,15602,16,0.056,8240,0,0.036
280,114702,10/30/2025,Sheppard Ave E / Greenbriar Rd,-79.38032499,43.76840988,2,13447653,2109,14,29110,36,0.018,1214,2025-10-30T08:15:00,2420,3,0.035,2025-10-30T16:45:00,2623,2,0.008,1057,2,0.014,13498,19,0.02,732,2,0.014,13823,13,0.018
281,114296,10/29/2025,Leslie St / Talwood Dr (South),-79.35685211,43.73830589,2,13452118,,14,28850,19,0.031,73,2025-10-29T08:00:00,2934,3,0.036,2025-10-29T15:15:00,2707,0,0.03,15393,8,0.031,182,1,0.038,13275,10,0.03,0,0,0
282,114651,10/29/2025,O'Connor Dr / Amsterdam Ave,-79.30598766,43.71429782,2,13455637,,14,15054,91,0.033,871,2025-10-29T08:00:00,1227,7,0.037,2025-10-29T14:45:00,1329,6,0.032,7193,44,0.034,919,8,0.02,6942,39,0.034,0,0,0
283,114647,10/29/2025,Strathmore Blvd / Donlands Ave,-79.33765219,43.68124622,2,13461414,,14,12574,311,0.05,3591,2025-10-29T08:15:00,1025,34,0.076,2025-10-29T17:30:00,1164,36,0.028,6443,114,0.047,1216,61,0.02,4587,115,0.04,328,21,0.369
284,114690,10/29/2025,Sheppard Ave W / Seeley Dr,-79.4942433,43.7431062,2,13451649,,14,30299,66,0.051,203,2025-10-29T08:00:00,2383,8,0.066,2025-10-29T16:30:00,3093,9,0.034,0,0,0,14625,28,0.054,519,1,0.021,15155,37,0.049
285,114700,10/29/2025,Sheppard Ave E / Yonge St / Sheppard Ave W,-79.41093798,43.76150883,2,13448689,125,14,54597,400,0.028,20006,2025-10-29T08:00:00,4340,11,0.04,2025-10-29T18:00:00,4250,49,0.018,14779,80,0.027,11762,133,0.025,18483,133,0.03,9573,54,0.031
286,113581,10/29/2025,Finch Ave W / Wilmington Ave,-79.46072437,43.77025362,2,13447550,890,14,32288,173,0.039,1124,2025-10-29T08:00:00,2607,12,0.044,2025-10-29T17:15:00,3141,21,0.021,0,41,0,15751,25,0.039,3623,17,0.031,12914,90,0.042
287,113761,10/29/2025,The East Mall / North Queen St,-79.5494157,43.62047521,2,13469836,1056,14,31751,93,0.069,789,2025-10-29T09:15:00,1816,1,0.105,2025-10-29T15:15:00,3221,12,0.057,6567,25,0.045,8598,29,0.077,5506,22,0.096,11080,17,0.064
288,113760,10/29/2025,Shorncliffe Rd / North Queen St,-79.54066968,43.62247261,2,13469743,1327,14,22414,79,0.094,286,2025-10-29T08:45:00,1323,2,0.143,2025-10-29T15:45:00,2195,10,0.074,5909,13,0.124,7922,29,0.089,0,3,0,8583,34,0.079
289,113759,10/29/2025,Kipling Ave / North Queen St,-79.52850546,43.62521874,2,13469594,724,14,34632,98,0.074,538,2025-10-29T08:15:00,2633,3,0.094,2025-10-29T17:00:00,2974,7,0.03,14705,24,0.065,153,15,0.026,11749,37,0.09,8025,22,0.065
290,114278,10/29/2025,Danforth Ave / Royal Dr,-79.35942147,43.67609919,2,13462393,,14,25597,2583,0.032,5242,2025-10-29T07:45:00,2085,232,0.041,2025-10-29T16:15:00,2114,326,0.02,0,0,0,9590,1230,0.028,0,6,0,16007,1347,0.034
291,113631,10/29/2025,Keele St / Rogers Rd,-79.47159834,43.6821362,2,13461587,394,14,26959,284,0.06,5249,2025-10-29T07:45:00,2145,12,0.071,2025-10-29T17:00:00,2397,33,0.033,7604,77,0.058,9828,74,0.067,2003,30,0.038,7524,103,0.058
292,114289,10/29/2025,Rushbrooke Ave / Eastern Ave,-79.33113809,43.66010969,2,13464983,,14,12735,192,0.033,429,2025-10-29T07:30:00,951,11,0.037,2025-10-29T17:30:00,1144,24,0.01,4,11,0,3957,56,0.048,2753,44,0.023,6021,81,0.027
293,114304,10/29/2025,Lido Rd / Arrow Rd,-79.53085146,43.74181306,2,13451938,,14,14439,28,0.099,128,2025-10-29T08:00:00,1183,2,0.079,2025-10-29T17:00:00,1475,4,0.056,7478,20,0.097,189,0,0.042,6412,7,0.103,360,1,0.103
294,114809,10/28/2025,Morningside Ave / Passmore Ave,-79.24103028,43.83268088,2,30136531,,14,3909,9,0.215,13,2025-10-28T06:30:00,334,1,0.129,2025-10-28T17:30:00,387,0,0.129,1754,0,0.087,258,6,0.702,0,2,0,1897,1,0.268
295,114804,10/28/2025,Lansdowne Ave / Lappin Ave,-79.44573318,43.66488532,2,13464495,2420,14,12318,705,0.048,3164,2025-10-28T08:15:00,921,53,0.064,2025-10-28T17:00:00,1136,72,0.021,4937,313,0.051,2039,144,0.017,4845,175,0.061,497,73,0.012
296,114797,10/28/2025,Kingston Rd / St Clair Ave E / Brooklawn Ave,-79.23607801,43.72198162,2,13454337,,14,36902,128,0.041,1987,2025-10-28T07:45:00,3388,5,0.04,2025-10-28T17:00:00,3573,17,0.023,18038,53,0.04,1066,3,0.013,11539,54,0.029,6259,18,0.068
297,114796,10/28/2025,Lambeth Rd / Royal York Rd / Royal York Crt,-79.5171297,43.66030866,2,13465360,,14,22027,178,0.029,213,2025-10-28T07:45:00,2051,23,0.035,2025-10-28T17:00:00,2081,25,0.016,10331,70,0.031,740,2,0.023,9663,83,0.029,1293,23,0.018
298,113575,10/28/2025,Willowdale Ave / Cummer Ave,-79.40991705,43.78866326,2,13445027,806,14,24824,102,0.023,636,2025-10-28T08:15:00,2607,10,0.026,2025-10-28T16:45:00,2647,7,0.012,8424,37,0.016,5254,29,0.03,7210,18,0.016,3936,18,0.043
299,113592,10/28/2025,Humber College Blvd / Hwy 27 N,-79.6014434,43.73046849,2,13453882,1162,14,38725,109,0.074,2246,2025-10-28T07:30:00,2871,6,0.081,2025-10-28T15:30:00,3569,3,0.062,12409,35,0.073,6212,25,0.048,13831,14,0.075,6273,35,0.098
300,114682,10/28/2025,Manstor Rd / North Queen St,-79.55767007,43.61821543,2,13469943,,14,14776,21,0.109,126,2025-10-28T09:15:00,835,2,0.186,2025-10-28T15:30:00,1402,2,0.073,6139,13,0.047,0,0,0,7579,7,0.099,1058,1,0.541
301,113597,10/28/2025,Wilson Ave / Julian Rd / Petherhill Ave / Ridge Park Trl,-79.49109901,43.72461243,2,13454469,1636,14,26511,86,0.057,2827,2025-10-28T08:00:00,2401,6,0.059,2025-10-28T16:45:00,2456,15,0.035,598,10,0.027,8944,31,0.072,3429,8,0.03,13540,37,0.054
302,113587,10/28/2025,Jane St / Clair Rd / Spenvalley Dr,-79.51366386,43.74122796,2,13451997,1127,14,21157,157,0.048,2402,2025-10-28T08:15:00,1741,8,0.061,2025-10-28T16:45:00,2086,20,0.028,10043,56,0.053,1498,23,0.025,8393,59,0.051,1223,19,0.017
303,113595,10/28/2025,Kipling Ave / Brookmere Rd / Westhumber Blvd,-79.57466032,43.72813971,2,13454154,733,14,20497,86,0.054,3362,2025-10-28T08:15:00,1729,13,0.061,2025-10-28T14:45:00,1944,4,0.05,7520,22,0.05,2381,18,0.09,7839,37,0.044,2757,9,0.062
304,114649,10/28/2025,Pharmacy Ave / Conroy Ave,-79.28785428,43.70273256,2,13457479,,14,11724,66,0.034,432,2025-10-28T08:15:00,1126,2,0.044,2025-10-28T15:15:00,1163,5,0.049,5331,31,0.036,164,1,0.012,5727,29,0.035,502,5,0.016
305,113693,10/28/2025,Dundas St E / Victoria St,-79.3795762,43.65629133,2,13465716,1905,14,14430,1866,0.028,25165,2025-10-28T08:45:00,1147,130,0.041,2025-10-28T17:30:00,1262,224,0.012,504,107,0.008,4685,735,0.024,2134,195,0.031,7107,829,0.031
306,113586,10/28/2025,Markham Rd / Kingston Rd,-79.21703594,43.73877681,2,13451718,148,14,36123,57,0.039,1330,2025-10-28T08:00:00,3196,5,0.042,2025-10-28T17:00:00,3428,7,0.019,5202,19,0.075,13374,16,0.026,2455,8,0.02,15092,14,0.041
307,114501,10/28/2025,Sheppard Ave E / Consumers Rd / Brian Dr,-79.33123672,43.77509959,2,13446581,906,14,28953,146,0.038,3263,2025-10-28T09:00:00,2352,9,0.039,2025-10-28T16:30:00,3082,12,0.029,3862,13,0.016,10431,45,0.04,3172,38,0.047,11488,50,0.042
308,113710,10/28/2025,Queen St E / Victoria St,-79.37809183,43.65268207,2,13466287,28,14,6180,612,0.038,19547,2025-10-28T08:15:00,515,57,0.035,2025-10-28T16:45:00,553,73,0.022,2131,175,0.051,1772,153,0.035,2277,283,0.029,0,1,0
309,113713,10/28/2025,Dundas St W / Denison Ave,-79.40223944,43.65203613,2,13466443,542,14,13704,2448,0.034,6297,2025-10-28T08:00:00,1249,199,0.042,2025-10-28T15:45:00,1170,227,0.021,645,370,0.045,6031,806,0.036,1581,527,0.032,5447,745,0.031
310,113607,10/28/2025,Kipling Ave / Belfield Rd,-79.56346298,43.70484994,2,13457759,731,14,39744,43,0.09,556,2025-10-28T07:45:00,2884,6,0.1,2025-10-28T15:00:00,3604,3,0.075,13134,19,0.084,10743,1,0.111,9768,20,0.059,6099,3,0.114
311,113613,10/28/2025,Warden Ave / Hollis Ave,-79.27303815,43.69287156,2,13459088,360,14,17825,113,0.033,381,2025-10-28T08:00:00,1592,8,0.036,2025-10-28T16:45:00,1935,14,0.017,6420,40,0.039,2241,34,0.012,2407,17,0.055,6757,22,0.026
312,113610,10/28/2025,Belfield Rd / Hwy 27 N,-79.58700078,43.69927127,2,13458687,1160,14,45355,23,0.123,76,2025-10-28T07:45:00,3715,6,0.113,2025-10-28T16:30:00,4717,5,0.07,14234,0,0.094,8192,13,0.152,16210,4,0.108,6719,6,0.183
313,114418,10/26/2025,Finch Ave E / Pharmacy Ave,-79.32596937,43.79433143,2,13444158,1092,14,29166,135,0.017,1204,2025-10-26T09:15:00,1783,7,0.021,2025-10-26T14:00:00,2890,8,0.014,3974,32,0.004,9899,28,0.023,3017,48,0.005,12276,27,0.019
314,114417,10/26/2025,Collingsbrook Blvd / Corinthian Blvd / Pharmacy Ave,-79.32355957,43.78948527,2,13444748,1520,14,5859,82,0.004,263,2025-10-26T09:00:00,371,9,0.011,2025-10-26T15:15:00,553,3,0.009,2841,25,0.005,452,10,0.002,2073,30,0.005,493,17,0
315,114416,10/26/2025,Ashtonbee Rd / Pharmacy Ave,-79.29862347,43.72852209,2,13453497,1295,14,23888,107,0.007,998,2025-10-26T09:15:00,1169,4,0.009,2025-10-26T14:45:00,2631,10,0.005,8180,35,0.008,6002,17,0.005,9618,49,0.008,88,6,0
316,114415,10/26/2025,Pharmacy Ave / Craigton Dr,-79.29810003,43.72722666,2,13453748,2701,14,18136,82,0.012,413,2025-10-26T09:15:00,922,3,0.012,2025-10-26T14:45:00,2020,5,0.008,6705,26,0.01,0,2,0,9028,49,0.009,2403,5,0.028
317,114414,10/26/2025,Pharmacy Ave / Gatineau Hydro Corridor Trl,-79.29923527,43.72999789,2,30000992,2268,14,17062,213,0.009,762,2025-10-26T09:15:00,843,9,0.009,2025-10-26T14:45:00,1854,15,0.007,8048,43,0.008,0,52,0,9013,70,0.009,1,48,0
318,114413,10/26/2025,Biscayne Blvd / Pharmacy Ave,-79.2997853,43.73134322,2,13453073,,14,17909,89,0.009,410,2025-10-26T09:15:00,859,3,0.008,2025-10-26T14:30:00,1952,20,0.007,7897,33,0.008,190,8,0,9030,42,0.009,792,6,0.005
319,114412,10/26/2025,Corinthian Blvd / Pinemeadow Blvd / Pharmacy Ave,-79.32498049,43.79279074,2,13444341,1465,14,7472,91,0.004,325,2025-10-26T08:45:00,468,10,0.006,2025-10-26T15:30:00,714,3,0.007,3411,28,0.005,1127,19,0.003,2128,38,0.004,806,6,0.004
320,114411,10/26/2025,Pharmacy Ave / Innisdale Dr,-79.30123613,43.73487431,2,13452529,2227,14,16527,60,0.008,336,2025-10-26T09:15:00,802,4,0.007,2025-10-26T14:30:00,1794,7,0.007,7741,24,0.008,0,2,0,8617,31,0.009,169,3,0
321,114410,10/26/2025,Pharmacy Ave / Surrey Ave,-79.30228068,43.73741454,2,13452130,688,14,18132,61,0.008,386,2025-10-26T09:15:00,871,4,0.009,2025-10-26T14:00:00,1971,7,0.006,7637,29,0.008,671,4,0.001,8784,25,0.009,1040,3,0.005
322,114409,10/26/2025,Pharmacy Ave / Inniswood Dr,-79.30306357,43.73935731,2,13451832,1411,14,16417,66,0.009,314,2025-10-26T09:15:00,790,3,0.009,2025-10-26T15:00:00,1775,7,0.007,7717,33,0.008,0,1,0,8488,31,0.009,212,1,0
323,114408,10/26/2025,Brian Ave / Pharmacy Ave,-79.30583797,43.746206,2,13450728,1187,14,14679,62,0.009,344,2025-10-26T09:15:00,667,1,0.013,2025-10-26T14:00:00,1769,6,0.008,7711,31,0.008,827,8,0.001,6141,17,0.01,0,6,0
324,114407,10/26/2025,Lawrence Ave E / Pharmacy Ave,-79.30464557,43.74324252,2,13451212,408,14,41749,119,0.012,1680,2025-10-26T09:15:00,2156,7,0.014,2025-10-26T14:00:00,4418,9,0.01,7624,31,0.008,14751,36,0.013,8787,22,0.01,10587,30,0.015
325,114405,10/26/2025,Pharmacy Ave / Dewey Dr,-79.30937811,43.75501534,2,13449395,1882,14,14725,33,0.009,332,2025-10-26T09:15:00,653,1,0.012,2025-10-26T14:00:00,1853,5,0.008,7325,17,0.008,979,2,0.001,6214,13,0.011,207,1,0
326,114404,10/26/2025,Kellyvale Rd / Pharmacy Ave,-79.31015331,43.75702394,2,13449121,2254,14,14414,30,0.009,709,2025-10-26T09:15:00,673,1,0.012,2025-10-26T14:00:00,1668,3,0.008,7181,13,0.009,410,2,0,6099,13,0.011,724,2,0.006
327,114403,10/26/2025,Ellesmere Rd / Pharmacy Ave,-79.3101889,43.75903129,2,13448838,693,14,29287,86,0.015,2094,2025-10-26T09:15:00,1536,4,0.016,2025-10-26T14:30:00,3241,17,0.015,2936,23,0.016,10782,31,0.016,5891,12,0.012,9678,20,0.016
328,114402,10/26/2025,Sheppard Ave E / Pharmacy Ave,-79.31776415,43.77651478,2,13446373,749,14,17237,107,0.026,1276,2025-10-26T09:15:00,975,3,0.034,2025-10-26T14:00:00,1732,8,0.02,2943,11,0.004,5923,43,0.037,1581,13,0.001,6790,40,0.031
329,114401,10/26/2025,Pharmacy Ave / Rosscowan Gt,-79.32180859,43.78544115,2,13445277,1753,14,5102,58,0.005,203,2025-10-26T08:45:00,311,6,0.006,2025-10-26T14:45:00,480,8,0.006,2909,24,0.005,102,3,0,2085,28,0.005,6,3,0
330,114663,10/26/2025,Neilson Rd / Finch Ave E,-79.22760057,43.81626586,2,13442074,1587,14,17927,41,0.023,504,2025-10-26T09:15:00,1118,5,0.026,2025-10-26T14:00:00,1722,1,0.019,2025,6,0.006,5109,9,0.028,5632,9,0.017,5161,17,0.032
331,114666,10/26/2025,Hwy 401 Collectors W Neilson Rd Ramp / Hwy 401 Collectors W Ramp / Neilson Rd / Neilson Rd S,-79.21635808,43.79508705,2,13443860,1361,14,29805,19,0.011,34,2025-10-26T09:15:00,1924,2,0.011,2025-10-26T14:00:00,2740,1,0.012,12383,5,0.012,4903,0,0.006,12519,14,0.011,0,0,0
332,114667,10/26/2025,Neilson Rd / Keeler Blvd / Oakmeadow Blvd,-79.21163069,43.79004228,2,13444470,1538,14,14088,21,0.014,238,2025-10-26T09:15:00,809,1,0.019,2025-10-26T15:15:00,1367,4,0.016,6826,8,0.015,1123,4,0.005,5486,8,0.016,653,1,0.003
333,114664,10/26/2025,Neilson Rd / Wickson Trl / Berner Trl,-79.21779956,43.8020741,2,13443108,1474,14,24289,28,0.012,259,2025-10-26T09:15:00,1574,0,0.013,2025-10-26T15:00:00,2295,6,0.012,9908,11,0.013,1626,3,0.004,11421,11,0.012,1334,3,0.005
334,114672,10/26/2025,Neilson Rd: Tapscott Rd - McLevin Ave,-79.21995178,43.80808967,1,12834067,1658,14,14878,54,0.014,1323,2025-10-26T09:15:00,982,1,0.017,2025-10-26T14:00:00,1371,2,0.013,7149,40,0.014,222,1,0.005,7507,8,0.015,0,5,0
335,114671,10/26/2025,Neilson Rd / Sewells Rd / Tapscott Rd,-79.21865432,43.80653698,2,13442715,1382,14,24893,88,0.015,1440,2025-10-26T09:15:00,1598,3,0.018,2025-10-26T14:45:00,2396,13,0.016,7316,24,0.014,3896,21,0.013,9822,18,0.014,3859,25,0.02
336,114670,10/26/2025,Neilson Rd / McLevin Ave,-79.22165895,43.80917399,2,13442522,1339,14,21465,89,0.011,2065,2025-10-26T09:15:00,1370,5,0.012,2025-10-26T14:00:00,2034,7,0.009,6636,32,0.014,4246,33,0.003,7508,12,0.014,3075,12,0.005
337,114429,10/26/2025,Denton Ave / Pharmacy Ave,-79.28407289,43.69394058,2,13458925,1294,14,8607,189,0.014,1287,2025-10-26T09:15:00,451,4,0.016,2025-10-26T14:30:00,891,24,0.017,3654,65,0.015,1383,53,0.005,2212,36,0.008,1358,35,0.032
338,114428,10/26/2025,Albion Ave / Pharmacy Ave,-79.284806,43.69563591,2,13458602,2200,14,7588,172,0.015,1062,2025-10-26T09:15:00,395,5,0.018,2025-10-26T14:45:00,803,23,0.015,3851,95,0.014,0,3,0,3498,59,0.017,239,15,0.004
339,114427,10/26/2025,Pharmacy Ave / Teesdale Pl / Prairie Drive Park Trl,-79.28539951,43.69699829,2,13458358,1034,14,8820,170,0.013,1085,2025-10-26T09:15:00,468,6,0.015,2025-10-26T14:45:00,950,23,0.013,3783,61,0.014,63,6,0,3631,77,0.015,1343,26,0.005
340,114426,10/26/2025,Pharmacy Ave / Dolphin Dr,-79.2867296,43.70008428,2,13457926,1870,14,8382,97,0.013,854,2025-10-26T09:15:00,487,4,0.016,2025-10-26T14:45:00,914,16,0.011,3951,45,0.014,438,4,0,3842,33,0.015,151,15,0.013
341,114425,10/26/2025,Chester Le Blvd / Huntingdale Blvd / Pharmacy Ave,-79.3271864,43.79635783,2,13443916,1240,14,8509,90,0.004,698,2025-10-26T09:15:00,552,4,0.004,2025-10-26T14:00:00,874,7,0.005,2580,24,0.005,1392,21,0.004,3138,30,0.003,1399,15,0.001
342,114424,10/26/2025,Knightsbridge Rd / Pharmacy Ave,-79.29361923,43.71617232,2,13455320,2125,14,16634,105,0.008,477,2025-10-26T09:15:00,910,5,0.008,2025-10-26T14:45:00,1829,8,0.005,8525,35,0.008,0,5,0,7590,45,0.009,519,20,0
343,114423,10/26/2025,Pharmacy Ave / Nancy Ave,-79.28941924,43.70635376,2,13456904,2170,14,10406,78,0.011,401,2025-10-26T09:15:00,616,5,0.011,2025-10-26T14:45:00,1122,7,0.01,4889,41,0.011,202,9,0,5201,26,0.012,114,2,0.018
344,114422,10/26/2025,Comstock Rd / Pharmacy Ave,-79.29492452,43.71931786,2,13454827,941,14,20195,104,0.007,545,2025-10-26T09:15:00,1019,3,0.01,2025-10-26T14:45:00,2309,8,0.004,7201,40,0.01,5149,20,0.003,7845,43,0.008,0,1,0
345,114421,10/26/2025,Pharmacy Ave: Alvinston Rd - Eglinton Ave E,-79.29710954,43.72443566,1,111724,1617,14,14528,65,0.009,262,2025-10-26T09:15:00,790,5,0.01,2025-10-26T14:45:00,1683,2,0.005,6694,29,0.01,0,0,0,6660,34,0.01,1174,2,0.003
346,114420,10/26/2025,Pharmacy Ave / Huntingwood Dr,-79.32016499,43.78167615,2,13445713,1052,14,10846,125,0.009,312,2025-10-26T09:15:00,639,7,0.017,2025-10-26T14:00:00,1084,14,0.009,2855,25,0.005,3187,35,0.011,1727,21,0.007,3077,44,0.011
347,114419,10/26/2025,Eglinton Ave E / Pharmacy Ave,-79.29755046,43.7256446,2,13453978,452,14,40344,314,0.014,3325,2025-10-26T09:15:00,2240,17,0.017,2025-10-26T14:45:00,4119,19,0.01,7184,43,0.019,12600,104,0.016,6861,71,0.01,13699,96,0.013
348,114668,10/26/2025,Neilson Rd / Livonia Pl / Purpledusk Trl,-79.2062925,43.78554174,2,13445040,1778,14,11537,44,0.016,567,2025-10-26T09:15:00,684,0,0.016,2025-10-26T15:15:00,1100,9,0.016,5486,18,0.018,762,8,0.001,4968,14,0.018,321,4,0
349,114665,10/26/2025,Neilson Rd / Crow Trl / Neilson Park Trl,-79.22572838,43.8122244,2,13442276,1728,14,13504,28,0.018,683,2025-10-26T09:15:00,883,3,0.023,2025-10-26T16:30:00,1279,4,0.018,5127,14,0.028,0,2,0,6882,12,0.015,1495,0,0.003
350,114400,10/26/2025,Chester Le Blvd / Beverly Glen Blvd / Pharmacy Ave,-79.32968402,43.8018078,2,13443298,1633,14,5845,89,0.004,259,2025-10-26T09:15:00,357,5,0.006,2025-10-26T14:00:00,599,6,0.005,2726,28,0.005,491,19,0,2087,27,0.004,541,15,0.004
351,114399,10/26/2025,McNicoll Ave / Pharmacy Ave,-79.33073401,43.80412261,2,13443081,1241,14,18759,150,0.009,305,2025-10-26T09:15:00,1171,15,0.006,2025-10-26T14:00:00,1845,16,0.012,3800,29,0.008,6613,42,0.011,2351,45,0.004,5995,34,0.01
352,114669,10/26/2025,Ellesmere Rd / Neilson Rd,-79.20494573,43.78261043,2,13445401,901,14,16617,46,0.046,2098,2025-10-26T09:15:00,919,0,0.052,2025-10-26T15:15:00,1650,5,0.038,4169,16,0.024,4905,16,0.047,1966,4,0.083,5577,10,0.049
353,114397,10/26/2025,Gordon Baker Rd / Glendinning Ave / Pharmacy Ave,-79.33417512,43.81176063,2,13442443,1429,14,9658,80,0.007,123,2025-10-26T09:15:00,588,9,0.007,2025-10-26T16:30:00,944,5,0.008,4157,17,0.005,867,17,0.003,3279,20,0.006,1355,26,0.017
354,114370,10/25/2025,St Clair Ave E / Yonge St / St Clair Ave W,-79.3940774,43.68809706,2,13460295,46,14,22876,1220,0.017,18259,2025-10-25T09:15:00,1625,63,0.023,2025-10-25T18:00:00,2170,113,0.006,5574,473,0.022,5477,139,0.011,4330,428,0.023,7495,180,0.013
355,114768,10/25/2025,Bay St / Cumberland St,-79.38982324,43.67055383,2,13463382,2374,14,13466,831,0.018,15855,2025-10-25T09:15:00,887,42,0.026,2025-10-25T18:15:00,1323,74,0.012,5350,287,0.018,23,29,0.043,5362,346,0.018,2731,169,0.016
356,114198,10/22/2025,Leslie St: Overland Dr - Edwards Gardens Trl,-79.35519518,43.73160101,1,60034015,,14,25624,28,0.034,69,2025-10-22T08:00:00,2654,4,0.035,2025-10-22T15:45:00,2568,3,0.023,13373,15,0.034,0,0,0,11843,13,0.035,408,0,0.049
357,114191,10/22/2025,Woodbine Ave / Barker Ave (South),-79.31648429,43.69421056,2,13458964,,14,13799,292,0.04,674,2025-10-22T08:00:00,1168,46,0.052,2025-10-22T17:30:00,1145,34,0.018,6632,122,0.039,235,14,0.009,6564,147,0.042,368,9,0.022
358,114194,10/22/2025,Ossington Ave / Geary Ave,-79.42959266,43.67143416,2,13463330,,14,11157,291,0.046,660,2025-10-22T08:15:00,1010,35,0.059,2025-10-22T17:00:00,1099,28,0.03,5167,111,0.047,0,4,0,4719,69,0.052,1271,107,0.02
359,114204,10/22/2025,Pharmacy Ave / Princeway Dr,-79.3086413,43.75315082,2,13449678,,14,19387,56,0.026,298,2025-10-22T08:15:00,1743,8,0.032,2025-10-22T16:30:00,2179,2,0.02,8943,21,0.025,0,0,0,9745,35,0.028,699,0,0.021
360,114263,10/22/2025,Steeles Ave W / Klondike Dr,-79.55218291,43.76913956,2,13447902,,14,30070,71,0.091,181,2025-10-22T07:30:00,2171,4,0.094,2025-10-22T14:30:00,2423,5,0.083,462,1,0.009,14530,17,0.096,227,0,0.141,14851,53,0.088
361,114271,10/22/2025,Bayview Ave / Belsize Dr,-79.37493569,43.70510705,2,13457274,,14,16888,130,0.035,5565,2025-10-22T07:45:00,1730,11,0.034,2025-10-22T17:45:00,1368,16,0.027,7878,63,0.037,0,1,0,8435,60,0.034,575,6,0.035
362,114280,10/22/2025,Dundas St E / Berkeley St,-79.36735187,43.659123,2,13465232,,14,10285,1497,0.042,2768,2025-10-22T08:00:00,937,191,0.055,2025-10-22T17:30:00,863,156,0.013,370,63,0.114,4037,808,0.032,196,67,0.036,5682,559,0.044
363,114176,10/21/2025,Don Mills Rd / Rochefort Dr,-79.33793026,43.71801402,2,13455130,,14,26755,122,0.05,653,2025-10-21T07:45:00,2689,16,0.045,2025-10-21T17:30:00,2153,10,0.035,13929,61,0.049,2051,1,0.022,10775,60,0.056,0,0,0
364,114177,10/21/2025,Deauville Lane / Ferrand Dr / Rochefort Dr,-79.33197067,43.71941434,2,13454891,,14,3997,83,0.033,862,2025-10-21T08:00:00,428,9,0.03,2025-10-21T17:00:00,440,10,0.009,997,27,0.022,81,2,0.111,1594,44,0.031,1325,10,0.037
365,114178,10/21/2025,Deauville Lane / St Dennis Dr,-79.33136855,43.71836922,2,13455059,2522,14,12102,143,0.055,2256,2025-10-21T08:15:00,1136,18,0.044,2025-10-21T17:00:00,1181,17,0.031,1934,42,0.03,3629,23,0.078,4049,50,0.058,2490,28,0.035
366,114180,10/21/2025,Windom Rd / Ferrand Dr (West),-79.33573125,43.72045118,2,14129940,,14,1281,23,0.06,594,2025-10-21T08:30:00,133,3,0.045,2025-10-21T17:30:00,144,3,0.007,1128,13,0.047,135,0,0.104,18,10,0.556,0,0,0
367,114182,10/21/2025,Ferrand Dr / Rochefort Dr,-79.33495727,43.71873042,2,13455009,,14,3116,37,0.021,377,2025-10-21T08:15:00,307,6,0.026,2025-10-21T16:30:00,343,1,0.012,947,16,0.03,1133,10,0.018,95,3,0,941,8,0.018
368,114522,10/21/2025,Euclid Ave / Harbord St,-79.41342014,43.66076083,2,13465065,,14,7769,1267,0.024,2472,2025-10-21T08:15:00,689,151,0.036,2025-10-21T14:45:00,818,95,0.039,0,35,0,3259,635,0.032,2454,135,0.017,2056,462,0.019
369,114203,10/21/2025,Gerrard St E / Clonmore Dr,-79.27806682,43.68878374,2,13459860,,14,16385,99,0.021,236,2025-10-21T08:00:00,1553,5,0.021,2025-10-21T16:45:00,1789,4,0.015,8110,37,0.022,0,0,0,1225,33,0.014,7050,29,0.022
370,114521,10/21/2025,Manning Ave / Harbord St,-79.41466706,43.66052571,2,13465112,1522,14,6291,1387,0.024,3362,2025-10-21T08:15:00,658,151,0.027,2025-10-21T15:00:00,667,118,0.033,1363,269,0.017,2978,616,0.03,3,50,0,1947,452,0.018
371,114520,10/21/2025,Harbord St / Clinton St,-79.41585648,43.66028411,2,13465154,2320,14,5733,1194,0.024,2532,2025-10-21T08:15:00,512,115,0.023,2025-10-21T15:00:00,656,113,0.034,66,48,0.061,2962,579,0.027,1415,190,0.026,1290,377,0.012
372,114595,10/21/2025,Earlsdale Ave / Winona Dr (North),-79.43444266,43.68662319,2,13460671,,14,2762,264,0.023,574,2025-10-21T08:00:00,358,46,0.025,2025-10-21T16:45:00,298,41,0.003,2138,155,0.023,606,41,0.023,18,68,0,0,0,0
373,113797,10/21/2025,Lochleven Dr / Knowlton Dr / Coltbridge Crt,-79.22065432,43.73927065,2,13451638,,14,1269,14,0.019,462,2025-10-21T08:15:00,152,1,0.046,2025-10-21T14:45:00,160,0,0.025,120,2,0.008,422,5,0.024,285,4,0.011,442,3,0.023
374,114589,10/21/2025,Windom Rd / Ferrand Dr (East),-79.33283427,43.72134382,2,14130026,,14,610,52,0.08,555,2025-10-21T08:30:00,49,11,0.02,2025-10-21T17:30:00,82,5,0.012,15,16,0.067,0,0,0,321,35,0.109,274,1,0.047
375,114762,10/21/2025,Jutland Rd / Goodrich Rd,-79.5247037,43.62718827,2,13469479,,14,6259,36,0.05,499,2025-10-21T08:15:00,551,3,0.082,2025-10-21T16:30:00,625,5,0.01,1250,1,0.049,2079,16,0.051,0,1,0,2930,18,0.05
376,114524,10/21/2025,Harbord St / Markham St,-79.41097667,43.661265,2,13464980,,14,5709,1457,0.025,2250,2025-10-21T08:15:00,548,184,0.031,2025-10-21T17:15:00,566,246,0.011,171,38,0.053,3227,737,0.032,8,38,0,2303,644,0.012
377,114523,10/21/2025,Palmerston Blvd / Harbord St,-79.41219806,43.6610205,2,13465025,1311,14,5577,2920,0.02,3496,2025-10-21T08:15:00,547,325,0.035,2025-10-21T17:15:00,567,492,0.005,163,812,0.025,2982,807,0.027,277,802,0.022,2155,499,0.009
378,114499,10/19/2025,Sheppard Ave E / Gateforth Dr,-79.23030459,43.79561188,2,13443821,1789,14,11888,37,0.04,631,2025-10-19T09:15:00,696,4,0.039,2025-10-19T14:00:00,1174,10,0.033,730,1,0.007,5512,20,0.04,0,2,0,5646,14,0.044
379,114486,10/19/2025,Sheppard Ave E: Bay Mills Blvd - Amethyst Rd,-79.30238569,43.7800429,1,6292597,2030,14,14168,66,0.032,869,2025-10-19T09:15:00,724,7,0.039,2025-10-19T14:15:00,1483,9,0.022,0,2,0,6761,34,0.034,0,0,0,7407,30,0.031
380,114498,10/19/2025,Sheppard Ave E / Scunthorpe Rd,-79.24168801,43.79326088,2,13444135,1543,14,13372,31,0.034,472,2025-10-19T09:15:00,702,1,0.034,2025-10-19T14:00:00,1382,2,0.025,31,2,0,5707,17,0.035,1336,0,0.003,6298,12,0.039
381,114497,10/19/2025,Markham Rd / Sheppard Ave E,-79.23875298,43.79386982,2,13444062,701,14,41829,91,0.03,2730,2025-10-19T09:15:00,2634,13,0.034,2025-10-19T14:00:00,4153,13,0.023,14256,17,0.029,5967,20,0.032,14443,23,0.027,7163,31,0.035
382,114496,10/19/2025,Sheppard Ave E / Shorting Rd,-79.24897563,43.79174121,2,13444330,1435,14,13259,29,0.032,888,2025-10-19T09:15:00,712,1,0.044,2025-10-19T14:00:00,1367,5,0.028,1079,0,0.007,5971,11,0.039,44,0,0,6165,18,0.03
383,114484,10/19/2025,Sheppard Ave E / Bay Mills Blvd / Aragon Ave,-79.30437311,43.77956839,2,13445956,1333,14,16535,95,0.028,819,2025-10-19T09:15:00,882,5,0.032,2025-10-19T14:15:00,1727,14,0.02,1518,18,0.004,6719,31,0.034,387,10,0,7911,36,0.029
384,114495,10/19/2025,McCowan Rd / Sheppard Ave E,-79.25883875,43.78962016,2,13444619,938,14,42617,73,0.028,1989,2025-10-19T09:15:00,2524,3,0.038,2025-10-19T14:00:00,4147,9,0.024,13245,18,0.027,6559,21,0.036,14238,15,0.028,8575,19,0.023
385,114494,10/19/2025,Sheppard Ave E / Glen Watford Dr,-79.27605043,43.78592824,2,13445134,1436,14,17807,39,0.022,347,2025-10-19T09:15:00,1014,8,0.022,2025-10-19T14:15:00,1908,2,0.015,1763,1,0.001,7666,20,0.027,405,4,0.005,7973,14,0.022
386,114490,10/19/2025,Sheppard Ave E: Allanford Rd - Kennedy Rd,-79.29085695,43.78269138,1,106971,1444,14,17113,70,0.027,895,2025-10-19T09:15:00,888,4,0.032,2025-10-19T14:15:00,1797,8,0.022,2502,5,0.001,7289,34,0.031,160,5,0.006,7162,26,0.032
387,114489,10/19/2025,Sheppard Ave E / Allanford Rd,-79.29346265,43.78211721,2,13445612,863,14,16316,116,0.028,2600,2025-10-19T09:15:00,890,9,0.033,2025-10-19T14:15:00,1725,12,0.021,8,6,0,7724,62,0.029,575,19,0.005,8009,29,0.028
388,114493,10/19/2025,Sheppard Ave E / Lamont Ave,-79.28149677,43.78473245,2,13445288,2383,14,16619,75,0.027,372,2025-10-19T09:15:00,947,5,0.026,2025-10-19T14:15:00,1729,9,0.02,4,1,0.25,8150,43,0.029,194,3,0.01,8271,28,0.026
389,114483,10/19/2025,Sheppard Ave E / Settlers Rd / Hickorynut Parkette Trl,-79.32672677,43.77466401,2,13446629,1249,14,19001,90,0.026,888,2025-10-19T09:15:00,980,8,0.037,2025-10-19T14:30:00,1993,15,0.021,0,0,0,8526,37,0.029,648,9,0,9827,44,0.026
390,114479,10/19/2025,Sheppard Ave E / Herons Hill Way,-79.33511178,43.77554128,2,30013028,2092,14,22602,91,0.023,1117,2025-10-19T09:15:00,1212,2,0.027,2025-10-19T14:45:00,2309,10,0.019,0,7,0,10567,40,0.023,679,5,0.004,11356,39,0.023
391,114488,10/19/2025,Sheppard Ave E / Palmdale Dr,-79.31121401,43.77798616,2,13446173,2596,14,15669,62,0.029,454,2025-10-19T09:15:00,818,5,0.034,2025-10-19T15:00:00,1668,10,0.021,230,0,0.017,7007,30,0.031,387,0,0.005,8045,32,0.028
392,114492,10/19/2025,Sheppard Ave E: Reidmount Ave - Agincourt Dr,-79.28435,43.78414,1,11165069,1820,14,17772,81,0.026,795,2025-10-19T09:15:00,975,4,0.023,2025-10-19T14:00:00,1814,5,0.02,300,5,0,8325,51,0.029,605,2,0.007,8542,23,0.026
393,114491,10/19/2025,Kennedy Rd / Sheppard Ave E,-79.28826373,43.78328686,2,13445476,752,14,43406,110,0.019,2636,2025-10-19T09:15:00,2624,3,0.021,2025-10-19T14:15:00,4340,13,0.015,12183,14,0.014,8278,47,0.029,15069,17,0.012,7876,32,0.029
394,114500,10/19/2025,Sheppard Ave E / Lapsley Rd / Washburn Way,-79.22754279,43.79614812,2,13443760,1141,14,14130,72,0.035,1270,2025-10-19T09:15:00,915,2,0.033,2025-10-19T14:00:00,1412,10,0.03,2134,13,0.024,4840,25,0.039,1638,18,0.003,5518,16,0.045
395,114487,10/19/2025,Sheppard Ave E / Warden Ave,-79.30790592,43.7787311,2,13446075,750,14,35051,111,0.02,2990,2025-10-19T09:15:00,2158,6,0.02,2025-10-19T14:00:00,3440,15,0.014,10211,24,0.011,7617,32,0.032,9285,15,0.011,7938,40,0.029
396,114349,10/18/2025,St Clair Ave W / Caledonia Rd / Caledonia Park Rd / Earlscourt Park Trl,-79.45476399,43.67535922,2,13462755,490,14,26441,536,0.012,4195,2025-10-18T09:15:00,1939,20,0.014,2025-10-18T14:00:00,2287,60,0.008,7662,84,0.015,5833,184,0.017,5691,89,0.008,7255,179,0.007
397,114432,10/18/2025,St Clair Ave E / Avoca Ave,-79.38988691,43.68899246,2,13460123,498,14,16803,500,0.018,2748,2025-10-18T09:15:00,1184,23,0.019,2025-10-18T15:00:00,1527,49,0.016,0,4,0,8431,236,0.018,2086,69,0.049,6286,191,0.009
398,114373,10/18/2025,St Clair Ave W / Hounslow Heath Rd / Silverthorn Ave,-79.4599838,43.67420679,2,13462962,491,14,12607,428,0.007,3413,2025-10-18T09:15:00,1014,23,0.012,2025-10-18T18:15:00,1090,39,0.005,843,96,0.008,4632,156,0.007,316,37,0.003,6816,139,0.007
399,114371,10/18/2025,St Clair Ave E / Ferndale Ave,-79.3914923,43.68864754,2,13460187,1930,14,13667,386,0.009,5375,2025-10-18T09:15:00,981,27,0.011,2025-10-18T15:00:00,1259,26,0.008,268,21,0.011,7094,199,0.01,6,1,0,6299,165,0.008
400,114369,10/18/2025,St Clair Ave W / Deer Park Cres,-79.39797587,43.68731527,2,13460447,860,14,15303,391,0.01,6005,2025-10-18T09:15:00,1116,21,0.015,2025-10-18T15:00:00,1379,31,0.007,1084,33,0.006,6936,165,0.009,244,11,0.008,7039,182,0.011
401,114368,10/18/2025,Avenue Rd / St Clair Ave W / Glenn Gould Park Trl,-79.40149549,43.6866407,2,13460576,112,14,40254,474,0.01,4350,2025-10-18T09:15:00,2653,23,0.013,2025-10-18T15:00:00,3697,43,0.007,11377,80,0.01,7246,155,0.009,13714,85,0.011,7917,154,0.01
402,114367,10/18/2025,St Clair Ave W / Poplar Plains Rd,-79.40388319,43.68614493,2,13460681,2454,14,17091,404,0.011,1438,2025-10-18T09:15:00,1195,25,0.014,2025-10-18T17:30:00,1498,54,0.005,0,0,0,8975,130,0.011,1054,146,0.008,7062,128,0.01
403,114366,10/18/2025,St Clair Ave W / Russell Hill Rd,-79.40786052,43.68535294,2,13460848,478,14,16152,472,0.01,2602,2025-10-18T09:15:00,1159,28,0.016,2025-10-18T18:15:00,1506,49,0.005,1501,168,0.005,7685,127,0.011,8,19,0,6958,158,0.011
404,114365,10/18/2025,St Clair Ave W / Spadina Rd,-79.41116916,43.68462537,2,13460975,479,14,24501,506,0.011,4023,2025-10-18T09:15:00,1653,24,0.017,2025-10-18T17:30:00,2256,65,0.007,4570,113,0.013,7884,127,0.01,5114,125,0.009,6933,141,0.014
405,114364,10/18/2025,St Clair Ave W / Tweedsmuir Ave,-79.41339429,43.6841635,2,13461064,2002,14,15761,352,0.013,3857,2025-10-18T09:15:00,1089,20,0.024,2025-10-18T17:30:00,1379,50,0.006,692,42,0.006,7890,117,0.014,0,10,0,7179,183,0.013
406,114363,10/18/2025,St Clair Ave W / Wells Hill Ave / Wells Hill Park Trl,-79.41592131,43.68363381,2,13461167,1336,14,16564,393,0.012,8899,2025-10-18T09:15:00,1136,20,0.02,2025-10-18T17:30:00,1485,38,0.011,1794,31,0.005,7284,148,0.016,708,47,0.007,6778,167,0.01
407,114362,10/18/2025,Bathurst St / St Clair Ave W,-79.41830144,43.6831675,2,13461271,480,14,35540,602,0.02,14304,2025-10-18T09:15:00,2586,21,0.023,2025-10-18T17:00:00,3068,78,0.011,12615,165,0.018,7539,136,0.024,9612,94,0.019,5774,207,0.024
408,114361,10/18/2025,St Clair Ave W / Vaughan Rd,-79.42022359,43.68277261,2,13461343,484,14,18197,541,0.018,14712,2025-10-18T09:15:00,1333,25,0.023,2025-10-18T17:30:00,1600,58,0.01,4514,85,0.023,5358,190,0.025,2899,57,0.007,5426,209,0.014
409,114359,10/18/2025,St Clair Ave W / Christie St,-79.42571962,43.68170951,2,13461554,485,14,14236,771,0.012,11527,2025-10-18T09:15:00,1038,32,0.013,2025-10-18T17:30:00,1296,73,0.005,0,4,0,5356,306,0.013,3357,194,0.014,5523,267,0.01
410,114358,10/18/2025,St Clair Ave W / Arlington Ave,-79.42887061,43.6810489,2,13461675,1024,14,12678,624,0.009,8987,2025-10-18T09:15:00,946,20,0.008,2025-10-18T17:30:00,1158,63,0.002,1963,94,0.006,4842,231,0.01,511,54,0.004,5362,245,0.01
411,114357,10/18/2025,St Clair Ave W / Winona Dr,-79.43250383,43.68027618,2,13461822,486,14,12645,622,0.009,6933,2025-10-18T09:15:00,932,36,0.01,2025-10-18T18:15:00,1134,56,0.004,1786,133,0.005,4637,201,0.01,694,94,0.006,5528,194,0.009
412,114356,10/18/2025,St Clair Ave W / Alberta Ave,-79.4336724,43.68002127,2,13461874,2198,14,13459,563,0.009,5963,2025-10-18T09:15:00,930,27,0.012,2025-10-18T14:45:00,1214,54,0.007,1453,70,0.011,5168,198,0.01,965,112,0.004,5873,183,0.01
413,114355,10/18/2025,St Clair Ave W / Oakwood Ave (East),-79.43568954,43.67959202,2,13461950,487,14,22584,538,0.023,6535,2025-10-18T09:15:00,1661,19,0.021,2025-10-18T18:00:00,1954,52,0.018,7124,88,0.032,5760,214,0.009,4633,65,0.045,5067,171,0.008
414,114354,10/18/2025,St Clair Ave W / Glenholme Ave (East),-79.43861494,43.67893318,2,13462068,1712,14,9824,457,0.009,5060,2025-10-18T09:15:00,698,17,0.006,2025-10-18T17:45:00,886,38,0.003,2,33,0,4290,205,0.01,650,55,0.002,4882,164,0.008
415,114353,10/18/2025,St Clair Ave W / Northcliffe Blvd,-79.44088348,43.67842046,2,13462184,769,14,10572,456,0.009,5694,2025-10-18T09:15:00,739,26,0.007,2025-10-18T17:45:00,957,41,0.003,1285,71,0.007,4340,180,0.011,746,41,0.005,4201,164,0.008
416,114352,10/18/2025,Dufferin St / St Clair Ave W,-79.44307723,43.67794932,2,13462285,488,14,24501,530,0.027,16041,2025-10-18T09:15:00,1829,39,0.028,2025-10-18T18:00:00,2082,53,0.021,7701,146,0.036,4248,130,0.011,7310,87,0.04,5242,167,0.008
417,114351,10/18/2025,St Clair Ave W / Via Italia,-79.44566352,43.67737156,2,13462381,1610,14,11011,526,0.008,6809,2025-10-18T09:15:00,847,21,0.009,2025-10-18T15:15:00,998,50,0.008,0,16,0,4343,238,0.01,1286,65,0.01,5382,207,0.006
418,114350,10/18/2025,St Clair Ave W / Earlscourt Ave,-79.44743076,43.67700741,2,13462446,194,14,10770,437,0.008,7194,2025-10-18T09:15:00,843,19,0.009,2025-10-18T15:15:00,964,52,0.008,1197,53,0.011,4206,167,0.009,0,11,0,5367,206,0.007
419,114348,10/18/2025,St Clair Ave W / Laughton Ave,-79.45764749,43.67472277,2,13462870,1087,14,12713,396,0.008,4051,2025-10-18T09:15:00,1035,11,0.012,2025-10-18T16:30:00,1082,31,0.003,0,8,0,4967,182,0.009,989,53,0.007,6757,153,0.008
420,114347,10/18/2025,Weston Rd / Keele St / St Clair Ave W,-79.46762343,43.67253451,2,13463232,493,14,36486,714,0.021,11018,2025-10-18T09:15:00,2757,30,0.026,2025-10-18T15:15:00,3107,74,0.017,11915,180,0.028,7653,234,0.008,10414,141,0.031,6504,159,0.007
421,114346,10/18/2025,St Clair Ave W / Old Stock Yards Rd / Gunns Rd,-79.47112402,43.67178146,2,13463362,1404,14,25729,417,0.01,5380,2025-10-18T09:15:00,1701,14,0.013,2025-10-18T15:00:00,2360,59,0.008,4313,56,0.01,7369,137,0.007,4745,74,0.013,9302,150,0.012
422,114345,10/18/2025,St Clair Ave W / Mondovi Gt,-79.47519404,43.67085485,2,14172279,2028,14,20492,267,0.011,2261,2025-10-18T09:15:00,1395,13,0.014,2025-10-18T14:45:00,1911,31,0.009,479,10,0.004,9315,99,0.011,801,3,0,9897,155,0.011
423,114344,10/18/2025,St Clair Ave W / Symes Rd,-79.47762844,43.6703089,2,13463659,2390,14,20261,314,0.011,1826,2025-10-18T09:15:00,1428,21,0.013,2025-10-18T14:45:00,1828,40,0.01,737,40,0.005,9368,96,0.012,0,8,0,10156,170,0.011
424,114343,10/18/2025,St Clair Ave W / Runnymede Rd,-79.48355637,43.66897554,2,13463893,494,14,27034,551,0.019,3843,2025-10-18T09:15:00,1879,28,0.023,2025-10-18T14:15:00,2474,56,0.015,3052,147,0.032,9514,106,0.012,5210,153,0.027,9258,145,0.018
425,114342,10/18/2025,St Clair Ave W / Mould Ave,-79.48702064,43.66820648,2,13464022,2024,14,22613,196,0.013,2926,2025-10-18T09:15:00,1553,10,0.017,2025-10-18T14:15:00,2041,21,0.011,889,24,0.004,8699,63,0.014,4673,29,0.003,8352,80,0.019
426,114341,10/18/2025,St Clair Ave W / Scarlett Rd,-79.49926562,43.66607327,2,13464406,2010,14,17129,160,0.011,452,2025-10-18T09:15:00,1167,14,0.013,2025-10-18T17:00:00,1580,11,0.006,6820,68,0.009,6049,28,0.016,4260,64,0.008,0,0,0
427,114340,10/18/2025,Jane St / St Clair Ave W,-79.49176779,43.6671849,2,13464218,495,14,35915,196,0.024,1319,2025-10-18T09:15:00,2596,11,0.027,2025-10-18T15:30:00,3145,15,0.022,9361,42,0.037,8378,52,0.015,10509,64,0.03,7667,38,0.01
